,Movie Name,Year of Release,Runtime,Genre,Movie Rating,Metascore of Movie,Votes,Gross,Description
0,Guardians of the Galaxy Vol. 3,2023,150 ,"Action, Adventure, Comedy",8.2,64,156973,#158,"Still reeling from the loss of Gamora, Peter Quill rallies his team to defend the universe and one of their own - a mission that could mean the end of the Guardians if not successful."
1,John Wick: Chapter 4,2023,169 ,"Action, Crime, Thriller",8.0,78,190955,,"John Wick uncovers a path to defeating The High Table. But before he can earn his freedom, Wick must face off against a new enemy with powerful alliances across the globe and forces that turn old friends into foes."
2,Spider-Man: Across the Spider-Verse,2023,140 ,"Animation, Action, Adventure",9.1,86,50471,#16,"Miles Morales catapults across the Multiverse, where he encounters a team of Spider-People charged with protecting its very existence. When the heroes clash on how to handle a new threat, Miles must redefine what it means to be a hero."
3,Guardians of the Galaxy,2014,121 ,"Action, Adventure, Comedy",8.0,76,1219591,$333.18M,A group of intergalactic criminals must pull together to stop a fanatical warrior with plans to purge the universe.
4,Avatar: The Way of Water,2022,192 ,"Action, Adventure, Fantasy",7.7,67,387792,$659.68M,"Jake Sully lives with his newfound family formed on the extrasolar moon Pandora. Once a familiar threat returns to finish what was previously started, Jake must work with Neytiri and the army of the Na'vi race to protect their home."
5,Top Gun: Maverick,2022,130 ,"Action, Drama",8.3,78,591364,$718.73M,"After thirty years, Maverick is still pushing the envelope as a top naval aviator, but must confront ghosts of his past when he leads TOP GUN's elite graduates on a mission that demands the ultimate sacrifice from those chosen to fly it."
6,Everything Everywhere All at Once,2022,139 ,"Action, Adventure, Comedy",7.8,81,450375,$72.86M,A middle-aged Chinese immigrant is swept up into an insane adventure in which she alone can save existence by exploring other universes and connecting with the lives she could have led.
7,Heat,1995,170 ,"Action, Crime, Drama",8.3,76,676953,$67.44M,A group of high-end professional thieves start to feel the heat from the LAPD when they unknowingly leave a clue at their latest heist.
8,The Godfather,1972,175 ,"Crime, Drama",9.2,100,1910782,$134.97M,"Don Vito Corleone, head of a mafia family, decides to hand over his empire to his youngest son Michael. However, his decision unintentionally puts the lives of his loved ones in grave danger."
9,Dune,2021,155 ,"Action, Adventure, Drama",8.0,74,679591,$108.33M,A noble family becomes embroiled in a war for control over the galaxy's most valuable asset while its heir becomes troubled by visions of a dark future.
10,Interstellar,2014,169 ,"Adventure, Drama, Sci-Fi",8.7,74,1912318,$188.02M,"When Earth becomes uninhabitable in the future, a farmer and ex-NASA pilot, Joseph Cooper, is tasked to pilot a spacecraft, along with a team of researchers, to find a new planet for humans."
11,The Shawshank Redemption,1994,142 ,Drama,9.3,82,2747322,$28.34M,"Over the course of several years, two convicts form a friendship, seeking consolation and, eventually, redemption through basic compassion."
12,Guardians of the Galaxy Vol. 2,2017,136 ,"Action, Adventure, Comedy",7.6,67,716313,$389.81M,"The Guardians struggle to keep together as a team while dealing with their personal family issues, notably Star-Lord's encounter with his father, the ambitious celestial being Ego."
13,Harry Potter and the Sorcerer's Stone,2001,152 ,"Adventure, Family, Fantasy",7.6,65,809926,$317.58M,"An orphaned boy enrolls in a school of wizardry, where he learns the truth about himself, his family and the terrible evil that haunts the magical world."
14,Spider-Man: Into the Spider-Verse,2018,117 ,"Animation, Action, Adventure",8.4,87,571554,$190.24M,Teen Miles Morales becomes the Spider-Man of his universe and must join with five spider-powered individuals from other dimensions to stop a threat for all realities.
15,The Whale,2022,117 ,Drama,7.7,60,149208,,"A reclusive, morbidly obese English teacher attempts to reconnect with his estranged teenage daughter."
16,The Color Purple,1985,154 ,Drama,7.7,78,90646,$98.47M,A black Southern woman struggles to find her identity after suffering abuse from her father and others over four decades.
17,Once Upon a Time in Hollywood,2019,161 ,"Comedy, Drama",7.6,83,778677,$142.50M,A faded television actor and his stunt double strive to achieve fame and success in the final years of Hollywood's Golden Age in 1969 Los Angeles.
18,Inception,2010,148 ,"Action, Adventure, Sci-Fi",8.8,74,2414457,$292.58M,"A thief who steals corporate secrets through the use of dream-sharing technology is given the inverse task of planting an idea into the mind of a C.E.O., but his tragic past may doom the project and his team to disaster."
19,The Batman,2022,176 ,"Action, Crime, Drama",7.8,72,700937,$369.35M,"When a sadistic serial killer begins murdering key political figures in Gotham, Batman is forced to investigate the city's hidden corruption and question his family's involvement."
20,The Wolf of Wall Street,2013,180 ,"Biography, Comedy, Crime",8.2,75,1464262,$116.90M,"Based on the true story of Jordan Belfort, from his rise to a wealthy stock-broker living the high life to his fall involving crime, corruption and the federal government."
21,Spider-Man: No Way Home,2021,148 ,"Action, Adventure, Fantasy",8.2,71,798368,$804.75M,"With Spider-Man's identity now revealed, Peter asks Doctor Strange for help. When a spell goes wrong, dangerous foes from other worlds start to appear, forcing Peter to discover what it truly means to be Spider-Man."
22,Pulp Fiction,1994,154 ,"Crime, Drama",8.9,95,2110986,$107.93M,"The lives of two mob hitmen, a boxer, a gangster and his wife, and a pair of diner bandits intertwine in four tales of violence and redemption."
23,The Dark Knight,2008,152 ,"Action, Crime, Drama",9.0,84,2719947,$534.86M,"When the menace known as the Joker wreaks havoc and chaos on the people of Gotham, Batman must accept one of the greatest psychological and physical tests of his ability to fight injustice."
24,Avengers: Endgame,2019,181 ,"Action, Adventure, Drama",8.4,78,1181261,$858.37M,"After the devastating events of Avengers: Infinity War (2018), the universe is in ruins. With the help of remaining allies, the Avengers assemble once more in order to reverse Thanos' actions and restore balance to the universe."
25,Titanic,1997,194 ,"Drama, Romance",7.9,75,1219799,$659.33M,"A seventeen-year-old aristocrat falls in love with a kind but poor artist aboard the luxurious, ill-fated R.M.S. Titanic."
26,Puss in Boots: The Last Wish,2022,102 ,"Animation, Adventure, Comedy",7.9,73,131156,$168.46M,"When Puss in Boots discovers that his passion for adventure has taken its toll and he has burned through eight of his nine lives, he launches an epic journey to restore them by finding the mythical Last Wish."
27,Mad Max: Fury Road,2015,120 ,"Action, Adventure, Sci-Fi",8.1,90,1030766,$154.06M,"In a post-apocalyptic wasteland, a woman rebels against a tyrannical ruler in search for her homeland with the aid of a group of female prisoners, a psychotic worshiper and a drifter named Max."
28,RRR,2022,187 ,"Action, Drama",7.8,83,150614,$14.50M,A fictitious story about two legendary revolutionaries and their journey away from home before they started fighting for their country in the 1920s.
29,American Psycho,2000,102 ,"Crime, Drama, Horror",7.6,64,656863,$15.07M,"A wealthy New York City investment banking executive, Patrick Bateman, hides his alternate psychopathic ego from his co-workers and friends as he delves deeper into his violent, hedonistic fantasies."
30,The Banshees of Inisherin,2022,114 ,"Comedy, Drama",7.7,87,210133,,"Two lifelong friends find themselves at an impasse when one abruptly ends their relationship, with alarming consequences for both of them."
31,Parasite,2019,132 ,"Drama, Thriller",8.5,96,855817,$53.37M,Greed and class discrimination threaten the newly formed symbiotic relationship between the wealthy Park family and the destitute Kim clan.
32,The Green Mile,1999,189 ,"Crime, Drama, Fantasy",8.6,61,1335915,$136.80M,"A tale set on death row in a Southern jail, where gentle giant John possesses the mysterious power to heal people's ailments. When the lead guard, Paul, recognizes John's gift, he tries to help stave off the condemned man's execution."
33,Indiana Jones and the Raiders of the Lost Ark,1981,115 ,"Action, Adventure",8.4,85,987273,$248.16M,"In 1936, archaeologist and adventurer Indiana Jones is hired by the U.S. government to find the Ark of the Covenant before the Nazis can obtain its awesome powers."
34,Jurassic Park,1993,127 ,"Action, Adventure, Sci-Fi",8.2,68,1014461,$402.45M,A pragmatic paleontologist touring an almost complete theme park on an island in Central America is tasked with protecting a couple of kids after a power failure causes the park's cloned dinosaurs to run loose.
35,Thor: Ragnarok,2017,130 ,"Action, Adventure, Comedy",7.9,74,776736,$315.06M,"Imprisoned on the planet Sakaar, Thor must race against time to return to Asgard and stop Ragnarök, the destruction of his world, at the hands of the powerful and ruthless villain Hela."
36,The Departed,2006,151 ,"Crime, Drama, Thriller",8.5,85,1357035,$132.38M,An undercover cop and a mole in the police attempt to identify each other while infiltrating an Irish gang in South Boston.
37,Blade Runner 2049,2017,164 ,"Action, Drama, Mystery",8.0,81,604432,$92.05M,"Young Blade Runner K's discovery of a long-buried secret leads him to track down former Blade Runner Rick Deckard, who's been missing for thirty years."
38,Fight Club,1999,139 ,Drama,8.8,66,2187722,$37.03M,An insomniac office worker and a devil-may-care soap maker form an underground fight club that evolves into much more.
39,Goodfellas,1990,145 ,"Biography, Crime, Drama",8.7,92,1192413,$46.84M,"The story of Henry Hill and his life in the mafia, covering his relationship with his wife Karen and his mob partners Jimmy Conway and Tommy DeVito."
40,The Lord of the Rings: The Fellowship of the Ring,2001,178 ,"Action, Adventure, Drama",8.8,92,1916724,$315.54M,A meek Hobbit from the Shire and eight companions set out on a journey to destroy the powerful One Ring and save Middle-earth from the Dark Lord Sauron.
41,Whiplash,2014,106 ,"Drama, Music",8.5,89,905450,$13.09M,A promising young drummer enrolls at a cut-throat music conservatory where his dreams of greatness are mentored by an instructor who will stop at nothing to realize a student's potential.
42,Good Will Hunting,1997,126 ,"Drama, Romance",8.3,70,1004482,$138.43M,"Will Hunting, a janitor at M.I.T., has a gift for mathematics, but needs help from a psychologist to find direction in his life."
43,Kingsman: The Secret Service,2014,129 ,"Action, Adventure, Comedy",7.7,60,686980,$128.26M,"A spy organisation recruits a promising street kid into the agency's training program, while a global threat emerges from a twisted tech genius."
44,Aftersun,2022,102 ,Drama,7.7,95,63722,,Sophie reflects on the shared joy and private melancholy of a holiday she took with her father twenty years earlier. Memories real and imagined fill the gaps between as she tries to reconcile the father she knew with the man she didn't...
45,Se7en,1995,127 ,"Crime, Drama, Mystery",8.6,65,1698780,$100.13M,"Two detectives, a rookie and a veteran, hunt a serial killer who uses the seven deadly sins as his motives."
46,The Matrix,1999,136 ,"Action, Sci-Fi",8.7,73,1958969,$171.48M,"When a beautiful stranger leads computer hacker Neo to a forbidding underworld, he discovers the shocking truth--the life he knows is the elaborate deception of an evil cyber-intelligence."
47,Léon: The Professional,1994,110 ,"Action, Crime, Drama",8.5,64,1190035,$19.50M,"12-year-old Mathilda is reluctantly taken in by Léon, a professional assassin, after her family is murdered. An unusual relationship forms as she becomes his protégée and learns the assassin's trade."
48,Inglourious Basterds,2009,153 ,"Adventure, Drama, War",8.3,69,1492872,$120.54M,"In Nazi-occupied France during World War II, a plan to assassinate Nazi leaders by a group of Jewish U.S. soldiers coincides with a theatre owner's vengeful plans for the same."
49,Back to the Future,1985,116 ,"Adventure, Comedy, Sci-Fi",8.5,87,1239565,$210.61M,"Marty McFly, a 17-year-old high school student, is accidentally sent 30 years into the past in a time-traveling DeLorean invented by his close friend, the maverick scientist Doc Brown."
50,Ford v Ferrari,2019,152 ,"Action, Biography, Drama",8.1,81,419415,$117.62M,American car designer Carroll Shelby and driver Ken Miles battle corporate interference and the laws of physics to build a revolutionary race car for Ford in order to defeat Ferrari at the 24 Hours of Le Mans in 1966.
51,Schindler's List,1993,195 ,"Biography, Drama, History",9.0,95,1385840,$96.90M,"In German-occupied Poland during World War II, industrialist Oskar Schindler gradually becomes concerned for his Jewish workforce after witnessing their persecution by the Nazis."
52,Prisoners,2013,153 ,"Crime, Drama, Mystery",8.1,70,746577,$61.00M,"When Keller Dover's daughter and her friend go missing, he takes matters into his own hands as the police pursue multiple leads and the pressure mounts."
53,Black Swan,2010,108 ,"Drama, Thriller",8.0,79,789170,$106.95M,"Nina is a talented but unstable ballerina on the verge of stardom. Pushed to the breaking point by her artistic director and a seductive rival, Nina's grip on reality slips, plunging her into a waking nightmare."
54,Taxi Driver,1976,114 ,"Crime, Drama",8.2,94,864735,$28.26M,"A mentally unstable veteran works as a nighttime taxi driver in New York City, where the perceived decadence and sleaze fuels his urge for violent action."
55,Shutter Island,2010,138 ,"Mystery, Thriller",8.2,63,1361979,$128.01M,"Teddy Daniels and Chuck Aule, two US marshals, are sent to an asylum on a remote island in order to investigate the disappearance of a patient, where Teddy uncovers a shocking truth about the place."
56,The Grand Budapest Hotel,2014,99 ,"Adventure, Comedy, Crime",8.1,88,839327,$59.10M,"A writer encounters the owner of an aging high-class hotel, who tells him of his early years serving as a lobby boy in the hotel's glorious years under an exceptional concierge."
57,The Gentlemen,2019,113 ,"Action, Comedy, Crime",7.8,51,360955,$36.47M,"An American expat tries to sell off his highly profitable marijuana empire in London, triggering plots, schemes, bribery and blackmail in an attempt to steal his domain out from under him."
58,The Fifth Element,1997,126 ,"Action, Adventure, Sci-Fi",7.6,52,486355,$63.54M,"In the colorful future, a cab driver unwittingly becomes the central figure in the search for a legendary cosmic weapon to keep Evil and Mr. Zorg at bay."
59,All Quiet on the Western Front,2022,148 ,"Action, Drama, War",7.8,76,206348,,A young German soldier's terrifying experiences and distress on the western front during World War I.
60,Gladiator,2000,155 ,"Action, Adventure, Drama",8.5,67,1536974,$187.71M,A former Roman General sets out to exact vengeance against the corrupt emperor who murdered his family and sent him into slavery.
61,No Country for Old Men,2007,122 ,"Crime, Drama, Thriller",8.2,92,1002224,$74.28M,Violence and mayhem ensue after a hunter stumbles upon a drug deal gone wrong and more than two million dollars in cash near the Rio Grande.
62,The Irishman,2019,209 ,"Biography, Crime, Drama",7.8,94,404175,$7.00M,"An illustration of Frank Sheeran's life, from W.W.II veteran to hit-man for the Bufalino crime family and his alleged assassination of his close friend Jimmy Hoffa."
63,Sicario,2015,121 ,"Action, Crime, Drama",7.6,82,446562,$46.89M,An idealistic FBI agent is enlisted by a government task force to aid in the escalating war against drugs at the border area between the U.S. and Mexico.
64,Forrest Gump,1994,142 ,"Drama, Romance",8.8,82,2137427,$330.25M,"The presidencies of Kennedy and Johnson, the Vietnam War, the Watergate scandal and other historical events unfold from the perspective of an Alabama man with an IQ of 75, whose only desire is to be reunited with his childhood sweetheart."
65,The Silence of the Lambs,1991,118 ,"Crime, Drama, Thriller",8.6,86,1468386,$130.74M,"A young F.B.I. cadet must receive the help of an incarcerated and manipulative cannibal killer to help catch another serial killer, a madman who skins his victims."
66,Tombstone,1993,130 ,"Biography, Drama, History",7.8,50,156084,$56.51M,"A successful lawman's plans to retire anonymously in Tombstone, Arizona are disrupted by the kind of outlaws he was famous for eliminating."
67,The Prestige,2006,130 ,"Drama, Mystery, Sci-Fi",8.5,66,1365249,$53.09M,"After a tragic accident, two stage magicians in 1890s London engage in a battle to create the ultimate illusion while sacrificing everything they have to outwit each other."
68,Alien,1979,117 ,"Horror, Sci-Fi",8.5,89,903812,$78.90M,The crew of a commercial spacecraft encounter a deadly lifeform after investigating an unknown transmission.
69,Star Wars: Episode IV - A New Hope,1977,121 ,"Action, Adventure, Fantasy",8.6,90,1394303,$322.74M,"Luke Skywalker joins forces with a Jedi Knight, a cocky pilot, a Wookiee and two droids to save the galaxy from the Empire's world-destroying battle station, while also attempting to rescue Princess Leia from the mysterious Darth Vader."
70,Avengers: Infinity War,2018,149 ,"Action, Adventure, Sci-Fi",8.4,68,1124570,$678.82M,The Avengers and their allies must be willing to sacrifice all in an attempt to defeat the powerful Thanos before his blitz of devastation and ruin puts an end to the universe.
71,Harry Potter and the Goblet of Fire,2005,157 ,"Adventure, Family, Fantasy",7.7,81,647326,$290.01M,"Harry Potter finds himself competing in a hazardous tournament between rival schools of magic, but he is distracted by recurring nightmares."
72,American Beauty,1999,122 ,Drama,8.3,84,1173969,$130.10M,A sexually frustrated suburban father has a mid-life crisis after becoming infatuated with his daughter's best friend.
73,The Godfather Part II,1974,202 ,"Crime, Drama",9.0,90,1301667,$57.30M,"The early life and career of Vito Corleone in 1920s New York City is portrayed, while his son, Michael, expands and tightens his grip on the family crime syndicate."
74,The Shining,1980,146 ,"Drama, Horror",8.4,66,1049808,$44.02M,"A family heads to an isolated hotel for the winter where a sinister presence influences the father into violence, while his psychic son sees horrific forebodings from both past and future."
75,The Goonies,1985,114 ,"Adventure, Comedy, Family",7.7,62,285097,$61.50M,A group of young misfits called The Goonies discover an ancient map and set out on an adventure to find a legendary pirate's long-lost treasure.
76,Joker,2019,122 ,"Crime, Drama, Thriller",8.4,59,1355741,$335.45M,"The rise of Arthur Fleck, from aspiring stand-up comedian and pariah to Gotham's clown prince and leader of the revolution."
77,Jaws,1975,124 ,"Adventure, Mystery, Thriller",8.1,87,624464,$260.00M,"When a killer shark unleashes chaos on a beach community off Cape Cod, it's up to a local sheriff, a marine biologist, and an old seafarer to hunt the beast down."
78,Casablanca,1942,102 ,"Drama, Romance, War",8.5,100,583791,$1.02M,A cynical expatriate American cafe owner struggles to decide whether or not to help his former lover and her fugitive husband escape the Nazis in French Morocco.
79,Avatar,2009,162 ,"Action, Adventure, Fantasy",7.9,83,1342590,$760.51M,A paraplegic Marine dispatched to the moon Pandora on a unique mission becomes torn between following his orders and protecting the world he feels is his home.
80,Knives Out,2019,130 ,"Comedy, Crime, Drama",7.9,82,727828,$165.36M,"A detective investigates the death of the patriarch of an eccentric, combative family."
81,Requiem for a Dream,2000,102 ,Drama,8.3,71,862078,$3.64M,The drug-induced utopias of four Coney Island people are shattered when their addictions run deep.
82,Star Trek Into Darkness,2013,132 ,"Action, Adventure, Sci-Fi",7.7,72,489458,$228.78M,"After the crew of the Enterprise find an unstoppable force of terror from within their own organization, Captain Kirk leads a manhunt to a war-zone world to capture a one-man weapon of mass destruction."
83,The Princess Bride,1987,98 ,"Adventure, Comedy, Family",8.0,77,436235,$30.86M,"A bedridden boy's grandfather reads him the story of a farmboy-turned-pirate who encounters numerous obstacles, enemies and allies in his quest to be reunited with his true love."
84,Saving Private Ryan,1998,169 ,"Drama, War",8.6,91,1424170,$216.54M,"Following the Normandy Landings, a group of U.S. soldiers go behind enemy lines to retrieve a paratrooper whose brothers have been killed in action."
85,Django Unchained,2012,165 ,"Drama, Western",8.4,81,1600379,$162.81M,"With the help of a German bounty-hunter, a freed slave sets out to rescue his wife from a brutal plantation owner in Mississippi."
86,Moneyball,2011,133 ,"Biography, Drama, Sport",7.6,87,439976,$75.61M,Oakland A's general manager Billy Beane's successful attempt to assemble a baseball team on a lean budget by employing computer-generated analysis to acquire new players.
87,Braveheart,1995,178 ,"Biography, Drama, History",8.3,68,1056166,$75.60M,Scottish warrior William Wallace leads his countrymen in a rebellion to free his homeland from the tyranny of King Edward I of England.
88,Mission: Impossible - Fallout,2018,147 ,"Action, Adventure, Thriller",7.7,86,345219,$220.16M,"Ethan Hunt and his IMF team, along with some familiar allies, race against time after a mission gone wrong."
89,Almost Famous,2000,122 ,"Adventure, Comedy, Drama",7.9,90,283871,$32.53M,A high-school boy in the early 1970s is given the chance to write a story for Rolling Stone magazine about an up-and-coming rock band as he accompanies them on their concert tour.
90,Pride & Prejudice,2005,129 ,"Drama, Romance",7.8,82,308317,$38.41M,"Sparks fly when spirited Elizabeth Bennet meets single, rich, and proud Mr. Darcy. But Mr. Darcy reluctantly finds himself falling in love with a woman beneath his class. Can each overcome their own pride and prejudice?"
91,Oldboy,2003,120 ,"Action, Drama, Mystery",8.4,77,596759,$0.71M,"After being kidnapped and imprisoned for fifteen years, Oh Dae-Su is released, only to find that he must find his captor in five days."
92,Harry Potter and the Prisoner of Azkaban,2004,142 ,"Adventure, Family, Fantasy",7.9,82,656021,$249.36M,"Harry Potter, Ron and Hermione return to Hogwarts School of Witchcraft and Wizardry for their third year of study, where they delve into the mystery surrounding an escaped prisoner who poses a dangerous threat to the young wizard."
93,12 Angry Men,1957,96 ,"Crime, Drama",9.0,97,813497,$4.36M,The jury in a New York City murder trial is frustrated by a single member whose skeptical caution forces them to more carefully consider the evidence before jumping to a hasty verdict.
94,Pirates of the Caribbean: The Curse of the Black Pearl,2003,143 ,"Action, Adventure, Fantasy",8.1,63,1154245,$305.41M,"Blacksmith Will Turner teams up with eccentric pirate ""Captain"" Jack Sparrow to save his love, the governor's daughter, from Jack's former pirate allies, who are now undead."
95,Deadpool,2016,108 ,"Action, Comedy",8.0,65,1068560,$363.07M,"A wisecracking mercenary gets experimented on and becomes immortal but ugly, and sets out to track down the man who ruined his looks."
96,Blade Runner,1982,117 ,"Action, Drama, Sci-Fi",8.1,84,788349,$32.87M,A blade runner must pursue and terminate four replicants who stole a ship in space and have returned to Earth to find their creator.
97,The Breakfast Club,1985,97 ,"Comedy, Drama",7.8,66,414304,$45.88M,Five high school students meet in Saturday detention and discover how they have a great deal more in common than they thought.
98,Apocalypse Now,1979,147 ,"Drama, Mystery, War",8.4,94,682504,$83.47M,A U.S. Army officer serving in Vietnam is tasked with assassinating a renegade Special Forces Colonel who sees himself as a god.
99,One Flew Over the Cuckoo's Nest,1975,133 ,Drama,8.7,84,1029258,$112.00M,"In the Fall of 1963, a Korean War veteran and criminal pleads insanity and is admitted to a mental institution, where he rallies up the scared patients against the tyrannical nurse."
100,Gone Girl,2014,149 ,"Drama, Mystery, Thriller",8.1,79,1009152,$167.77M,"With his wife's disappearance having become the focus of an intense media circus, a man sees the spotlight turned on him when it's suspected that he may not be innocent."
101,The Help,2011,146 ,Drama,8.1,62,472692,$169.71M,"An aspiring author during the civil rights movement of the 1960s decides to write a book detailing the African American maids' point of view on the white families for which they work, and the hardships they go through on a daily basis."
102,Scarface,1983,170 ,"Crime, Drama",8.3,65,866710,$45.60M,"In 1980 Miami, a determined Cuban immigrant takes over a drug cartel and succumbs to greed."
103,Stand by Me,1986,89 ,"Adventure, Drama",8.1,75,417730,$52.29M,"After the death of one of his friends, a writer recounts a childhood journey with his friends to find the body of a missing boy."
104,Memento,2000,113 ,"Mystery, Thriller",8.4,81,1264170,$25.54M,A man with short-term memory loss attempts to track down his wife's murderer.
105,Moana,2016,107 ,"Animation, Adventure, Comedy",7.6,81,351983,$248.76M,"In Ancient Polynesia, when a terrible curse incurred by the Demigod Maui reaches Moana's island, she answers the Ocean's call to seek out the Demigod to set things right."
