,Movie Name,Year of Release,Runtime,Genre,Movie Rating,Metascore of Movie,Votes,Gross,Description
431,Cool Hand Luke,1967,127 ,"Crime, Drama",8.1,92,181821,$16.22M,"A laid back Southern man is sentenced to two years in a rural prison, but refuses to conform."
432,In the Mood for Love,2000,98 ,"Drama, Romance",8.1,87,156941,$2.73M,"Two neighbors form a strong bond after both suspect extramarital activities of their spouses. However, they agree to keep their bond platonic so as not to commit similar wrongs."
433,"Crouching Tiger, Hidden Dragon",2000,120 ,"Action, Adventure, Drama",7.9,94,275737,$128.08M,A young Chinese warrior steals a sword from a famed swordsman and then escapes into a world of romantic adventure with a mysterious man in the frontier of the nation.
434,The Fighter,2010,116 ,"Action, Biography, Drama",7.8,79,377167,$93.62M,"Based on the story of Micky Ward, a fledgling boxer who tries to escape the shadow of his more famous but troubled older boxing brother and get his own shot at greatness."
435,Perfect Blue,1997,81 ,"Animation, Crime, Drama",8.0,67,83959,$0.78M,"A pop singer gives up her career to become an actress, but she slowly goes insane when she starts being stalked by an obsessed fan and what seems to be a ghost of her past."
436,Dogville,2003,178 ,"Crime, Drama",8.0,59,153159,$1.53M,"A woman on the run from the mob is reluctantly accepted in a small Colorado community in exchange for labor, but when a search visits the town she finds out that their support has a price."
437,What We Do in the Shadows,2014,86 ,"Comedy, Horror",7.6,76,190283,$3.33M,"Viago, Deacon, and Vladislav are vampires who are struggling with the mundane aspects of modern life, like paying rent, keeping up with the chore wheel, trying to get into nightclubs, and overcoming flatmate conflicts."
438,Pink Floyd: The Wall,1982,95 ,"Drama, Fantasy, Music",8.0,47,83061,$22.24M,A confined but troubled rock star descends into madness in the midst of his physical and social isolation from everyone.
439,Stalker,1979,162 ,"Drama, Sci-Fi",8.1,83,138526,$0.23M,A guide leads two men through an area known as the Zone to find a room that grants wishes.
440,Ordinary People,1980,124 ,Drama,7.7,86,54446,$54.80M,"The accidental death of the older son of an affluent family deeply strains the relationships among the bitter mother, the good-natured father and the guilt-ridden younger son."
441,Ip Man,2008,106 ,"Action, Biography, Drama",8.0,59,228509,,"During the Japanese invasion of China, a wealthy martial artist is forced to leave his home when his city is occupied. With little means of providing for themselves, Ip Man and the remaining members of the city must find a way to survive."
442,My Neighbor Totoro,1988,86 ,"Animation, Comedy, Family",8.1,86,353038,$1.11M,"When two girls move to the country to be near their ailing mother, they have adventures with the wondrous forest spirits who live nearby."
443,La haine,1995,98 ,"Crime, Drama",8.1,0,181612,$0.31M,24 hours in the lives of three young men in the French suburbs the day after a violent riot.
444,All the President's Men,1976,138 ,"Drama, History, Thriller",7.9,84,120234,$70.60M,"""The Washington Post"" reporters Bob Woodward and Carl Bernstein uncover the details of the Watergate scandal that leads to President Richard Nixon's resignation."
445,This Is Spinal Tap,1984,82 ,"Comedy, Music",7.9,92,142956,$4.74M,"Spinal Tap, one of England's loudest bands, is chronicled by film director Marty DiBergi on what proves to be a fateful tour."
446,Awakenings,1990,121 ,"Biography, Drama",7.8,74,149201,$52.10M,"The victims of an encephalitis epidemic many years ago have been catatonic ever since, but now a new drug offers the prospect of reviving them."
447,Dawn of the Planet of the Apes,2014,130 ,"Action, Adventure, Drama",7.6,79,451899,$208.55M,The fragile peace between apes and humans is threatened as mistrust and betrayal threaten to plunge both tribes into a war for dominance over the Earth.
448,The Outlaw Josey Wales,1976,135 ,Western,7.8,69,76640,$31.80M,Missouri farmer Josey Wales joins a Confederate guerrilla unit and winds up on the run from the Union soldiers who murdered his family.
449,Thirteen Lives,2022,147 ,"Action, Adventure, Biography",7.8,66,60783,,A rescue mission is assembled in Thailand where a group of young boys and their soccer coach are trapped in a system of underground caves that are flooding.
450,Midnight Cowboy,1969,113 ,Drama,7.8,79,115084,$44.79M,"A naive hustler travels from Texas to New York City to seek personal fortune, finding a new friend in the process."
451,Who's Afraid of Virginia Woolf?,1966,131 ,Drama,8.0,75,77530,,"A bitter, aging couple, with the help of alcohol, use their young houseguests to fuel anguish and emotional pain towards each other over the course of a distressing night."
452,The Sting,1973,129 ,"Comedy, Crime, Drama",8.3,83,269690,$159.60M,Two grifters team up to pull off the ultimate con.
453,Misery,1990,107 ,"Drama, Thriller",7.8,75,221160,$61.28M,"After a famous author is rescued from a car crash by a fan of his novels, he comes to realize that the care he is receiving is only the beginning of a nightmare of captivity and abuse."
454,Gattaca,1997,106 ,"Drama, Sci-Fi, Thriller",7.8,64,312441,$12.34M,A genetically inferior man assumes the identity of a superior one in order to pursue his lifelong dream of space travel.
455,The Raid: Redemption,2011,101 ,"Action, Crime, Thriller",7.6,73,210291,$4.11M,A S.W.A.T. team becomes trapped in a tenement run by a ruthless mobster and his army of killers and thugs.
456,The Jungle Book,1967,78 ,"Animation, Adventure, Comedy",7.6,65,190142,$141.84M,Bagheera the Panther and Baloo the Bear have a difficult time trying to convince a boy to leave the jungle for human civilization.
457,Metropolis,1927,153 ,"Drama, Sci-Fi",8.3,98,178362,$1.24M,"In a futuristic city sharply divided between the working class and the city planners, the son of the city's mastermind falls in love with a working-class prophet who predicts the coming of a savior to mediate their differences."
458,The Skin I Live In,2011,120 ,"Drama, Horror, Mystery",7.6,70,158476,$3.19M,"A brilliant plastic surgeon, haunted by past tragedies, creates a type of synthetic skin that withstands any kind of damage. His guinea pig: a mysterious and volatile woman who holds the key to his obsession."
459,The Invisible Guest,2016,106 ,"Crime, Drama, Mystery",8.0,0,183021,,A successful entrepreneur accused of murder and a witness preparation expert have less than three hours to come up with an impregnable defense.
460,Gravity,2013,91 ,"Drama, Sci-Fi, Thriller",7.7,96,840994,$274.09M,Two astronauts work together to survive after an accident leaves them stranded in space.
461,Cinema Paradiso,1988,155 ,"Drama, Romance",8.5,80,268645,$11.99M,A filmmaker recalls his childhood when falling in love with the pictures at the cinema of his home village and forms a deep friendship with the cinema's projectionist.
462,Wild Tales,2014,122 ,"Comedy, Drama, Thriller",8.1,77,205478,$3.11M,Six short stories that explore the extremities of human behavior involving people in distress.
463,The King's Speech,2010,118 ,"Biography, Drama, History",8.0,88,692074,$138.80M,"The story of King George VI, his unexpected ascension to the throne of the British Empire in 1936, and the speech therapist who helped the unsure monarch overcome his stammer."
464,The Iron Giant,1999,86 ,"Animation, Action, Adventure",8.1,85,209369,$23.16M,A young boy befriends a giant robot from outer space that a paranoid government agent wants to destroy.
465,In the Heat of the Night,1967,110 ,"Drama, Mystery, Thriller",7.9,76,79567,$24.38M,"A black Philadelphia police detective is mistakenly suspected of a local murder while passing through a racially hostile Mississippi town, and after being cleared is reluctantly asked by the police chief to investigate the case."
466,Bringing Up Baby,1938,102 ,Comedy,7.8,91,63734,,"While trying to secure a $1 million donation for his museum, a befuddled paleontologist is pursued by a flighty and often irritating heiress and her pet leopard, Baby."
467,For a Few Dollars More,1965,132 ,"Drama, Western",8.2,74,262932,$15.00M,Two bounty hunters with the same intentions team up to track down an escaped Mexican outlaw.
468,"Paris, Texas",1984,145 ,Drama,8.1,81,110698,$2.18M,"Travis Henderson, an aimless drifter who has been missing for four years, wanders out of the desert and must reconnect with society, himself, his life, and his family."
469,Kung Fu Hustle,2004,99 ,"Action, Comedy, Fantasy",7.7,78,144607,$17.11M,"In Shanghai, China in the 1940s, a wannabe gangster aspires to join the notorious ""Axe Gang"" while residents of a housing complex exhibit extraordinary powers in defending their turf."
470,The Boondock Saints,1999,108 ,"Action, Thriller",7.7,44,243507,$0.03M,Two Irish Catholic brothers become vigilantes and wipe out Boston's criminal underworld in the name of God.
471,Carlito's Way,1993,144 ,"Crime, Drama, Thriller",7.9,66,224579,$36.95M,"A Puerto Rican former convict, just released from prison, pledges to stay away from drugs and violence despite the pressure around him and lead on to a better life outside of N.Y.C."
472,Ben-Hur,1959,212 ,"Adventure, Drama",8.1,90,245242,$74.70M,"After a Jewish prince is betrayed and sent into slavery by a Roman friend in 1st-century Jerusalem, he regains his freedom and comes back for revenge."
473,Moon,2009,97 ,"Drama, Mystery, Sci-Fi",7.8,67,366775,$5.01M,"Astronaut Sam Bell has a quintessentially personal encounter toward the end of his three-year stint on the Moon, where he, working alongside his computer, GERTY, sends back to Earth parcels of a resource that has helped diminish our planet's power problems."
474,Sense and Sensibility,1995,136 ,"Drama, Romance",7.7,84,120219,$43.18M,"Rich Mr. Dashwood dies, leaving his second wife and her three daughters poor by the rules of inheritance. The two eldest daughters are the title opposites."
475,Sunset Blvd.,1950,110 ,"Drama, Film-Noir",8.4,94,226980,#60,A screenwriter develops a dangerous relationship with a faded film star determined to make a triumphant return.
476,The Naked Gun: From the Files of Police Squad!,1988,85 ,"Comedy, Crime",7.6,76,175995,$78.76M,Incompetent police Detective Frank Drebin must foil an attempt to assassinate Queen Elizabeth II.
477,Demon Slayer the Movie: Mugen Train,2020,117 ,"Animation, Action, Adventure",8.2,72,64500,$47.70M,"After his family was brutally murdered and his sister turned into a demon, Tanjiro Kamado's journey as a demon slayer began. Tanjiro and his comrades embark on a new mission aboard the Mugen Train, on track to despair."
478,Road to Perdition,2002,117 ,"Crime, Drama, Thriller",7.7,72,276047,$104.45M,"A mob enforcer's son in 1930s Illinois witnesses a murder, forcing him and his father to take to the road, and his father down a path of redemption and revenge."
479,Boyhood,2014,165 ,Drama,7.9,100,360185,$25.38M,"The life of Mason, from early childhood to his arrival at college."
480,Butch Cassidy and the Sundance Kid,1969,110 ,"Biography, Crime, Drama",8.0,66,220830,$102.31M,"Wyoming, early 1900s. Butch Cassidy and The Sundance Kid are the leaders of a band of outlaws. After a train robbery goes wrong they find themselves on the run with a posse hard on their heels. Their solution - escape to Bolivia."
481,Rosemary's Baby,1968,137 ,"Drama, Horror",8.0,96,223688,,"A young couple trying for a baby moves into an aging, ornate apartment building on Central Park West, where they find themselves surrounded by peculiar neighbors."
482,Brazil,1985,132 ,"Drama, Sci-Fi",7.9,84,205269,$9.93M,A bureaucrat in a dystopic society becomes an enemy of the state as he pursues the woman of his dreams.
483,Flipped,2010,90 ,"Comedy, Drama, Romance",7.7,45,93549,$1.75M,Two eighth-graders start to have feelings for each other despite being total opposites.
484,A Fistful of Dollars,1964,99 ,"Action, Drama, Western",7.9,65,223538,$14.50M,"A wandering gunfighter plays two rival families against each other in a town torn apart by greed, pride, and revenge."
485,The Secret in Their Eyes,2009,129 ,"Drama, Mystery, Romance",8.2,80,214241,$6.39M,A retired legal counselor writes a novel hoping to find closure for one of his past unresolved homicide cases and for his unreciprocated love with his superior - both of which still haunt him decades later.
486,Dirty Harry,1971,102 ,"Action, Crime, Thriller",7.7,87,161846,$35.90M,"When a man calling himself ""the Scorpio Killer"" menaces San Francisco, tough-as-nails Police Inspector ""Dirty"" Harry Callahan is assigned to track down the crazed psychopath."
487,The Elephant Man,1980,124 ,"Biography, Drama",8.2,78,248048,#156,"A Victorian surgeon rescues a heavily disfigured man who is mistreated while scraping a living as a side-show freak. Behind his monstrous façade, there is revealed a person of kindness, intelligence and sophistication."
488,When Harry Met Sally...,1989,95 ,"Comedy, Drama, Romance",7.7,76,228582,$92.82M,"Harry and Sally have known each other for years, and are very good friends, but they fear sex would ruin the friendship."
489,A Silent Voice: The Movie,2016,130 ,"Animation, Drama",8.1,78,89866,,"A young man is ostracized by his classmates after he bullies a deaf girl to the point where she moves away. Years later, he sets off on a path for redemption."
490,Spartacus,1960,197 ,"Adventure, Biography, Drama",7.9,87,138588,$30.00M,"The slave Spartacus survives brutal training as a gladiator and leads a violent revolt against the decadent Roman Republic, as the ambitious Crassus seeks to gain power by crushing the uprising."
491,Glory,1989,122 ,"Biography, Drama, History",7.8,78,138910,$26.83M,"Robert Gould Shaw leads the U.S. Civil War's first all-black volunteer company, fighting prejudices from both his own Union Army, and the Confederates."
492,The Ten Commandments,1956,220 ,"Adventure, Drama, Family",7.9,0,74400,$93.74M,"Moses, raised as a prince of Egypt in the Pharaoh's household, learns of his true heritage as a Hebrew and his divine mission as the deliverer of his people from slavery."
493,Ghost in the Shell,1995,83 ,"Animation, Action, Crime",7.9,76,148593,$0.52M,A cyborg policewoman and her partner hunt a mysterious and powerful hacker called the Puppet Master.
494,The Wrestler,2008,109 ,"Drama, Sport, Thriller",7.9,80,313047,$26.24M,"A faded professional wrestler must retire, but finds his quest for a new life outside the ring a dispiriting struggle."
495,Serpico,1973,130 ,"Biography, Crime, Drama",7.7,81,128207,$29.80M,An honest New York cop named Frank Serpico blows the whistle on rampant corruption in the force only to have his comrades turn against him.
496,End of Watch,2012,109 ,"Action, Adventure, Crime",7.6,68,256861,$41.00M,"Shot documentary-style, this film follows the daily grind of two young police officers in LA who are partners and friends and what happens when they meet criminal forces greater than themselves."
497,Das Boot,1981,149 ,"Drama, War",8.4,86,255742,$11.49M,A German U-boat stalks the frigid waters of the North Atlantic as its young crew experience the sheer terror and claustrophobic life of a submariner in World War II.
498,Fried Green Tomatoes,1991,130 ,Drama,7.7,64,77980,$82.42M,A housewife who is unhappy with her life befriends an old lady at a nursing home and is enthralled by the tales she tells of people she used to know.
499,The Man from Earth,2007,87 ,"Drama, Fantasy, Mystery",7.9,0,192669,,An impromptu goodbye party for Professor John Oldman becomes a mysterious interrogation after the retiring scholar reveals to his colleagues he has a longer and stranger past than they can imagine.
500,Hunt for the Wilderpeople,2016,101 ,"Adventure, Comedy, Drama",7.8,81,135259,$5.20M,A national manhunt is ordered for a rebellious kid and his foster uncle who go missing in the wild New Zealand bush.
501,Enter the Dragon,1973,102 ,"Action, Crime, Drama",7.6,83,107800,$25.00M,A Shaolin martial artist travels to an island fortress to spy on an opium lord - who is also a former monk from his temple - under the guise of attending a fighting tournament.
502,Chungking Express,1994,102 ,"Comedy, Crime, Drama",8.0,78,88042,$0.60M,"Two melancholy Hong Kong policemen fall in love: one with a mysterious female underworld figure, the other with a beautiful and ethereal waitress at a late-night restaurant he frequents."
503,Naked,1993,131 ,"Comedy, Drama",7.7,85,41545,$1.77M,An unemployed Mancunian vents his rage on unsuspecting strangers as he embarks on a nocturnal London odyssey.
504,Walk the Line,2005,136 ,"Biography, Drama, Music",7.8,72,257451,$119.52M,"A chronicle of country music legend Johnny Cash's life, from his early days on an Arkansas cotton farm to his rise to fame with Sun Records in Memphis, where he recorded alongside Elvis Presley, Jerry Lee Lewis, and Carl Perkins."
505,Kiki's Delivery Service,1989,103 ,"Animation, Family, Fantasy",7.8,85,152026,,"A young witch, on her mandatory year of independent life, finds fitting into a new community difficult while she supports herself by running an air courier service."
506,Goldfinger,1964,110 ,"Action, Adventure, Thriller",7.7,87,195772,$51.08M,"While investigating a gold magnate's smuggling, James Bond uncovers a plot to contaminate the Fort Knox gold reserve."
507,Ponyo,2008,101 ,"Animation, Adventure, Comedy",7.6,86,151017,$15.09M,"A five-year-old boy develops a relationship with Ponyo, a young goldfish princess who longs to become a human after falling in love with him."
508,Singin' in the Rain,1952,103 ,"Comedy, Musical, Romance",8.3,99,249079,$8.82M,A silent film star falls for a chorus girl just as he and his delusionally jealous screen partner are trying to make the difficult transition to talking pictures in 1920s Hollywood.
509,Snow White and the Seven Dwarfs,1937,83 ,"Animation, Adventure, Family",7.6,96,206124,$184.93M,"Exiled into the dangerous forest by her wicked stepmother, a princess is rescued by seven dwarf miners who make her part of their household."
510,Donnie Brasco,1997,127 ,"Biography, Crime, Drama",7.7,76,317058,$41.91M,"An FBI undercover agent infiltrates the mob and finds himself identifying more with the mafia life, at the expense of his regular one."
511,The King of Comedy,1982,109 ,"Comedy, Crime, Drama",7.8,73,109551,$2.50M,"Rupert Pupkin is a passionate yet unsuccessful comic who craves nothing more than to be in the spotlight and to achieve this, he stalks and kidnaps his idol to take the spotlight for himself."
512,Philadelphia,1993,125 ,Drama,7.7,66,248888,$77.32M,"When a man with HIV is fired by his law firm because of his condition, he hires a homophobic small time lawyer as the only willing advocate for a wrongful dismissal suit."
513,Sound of Metal,2019,120 ,"Drama, Music",7.7,82,137139,,A heavy-metal drummer's life is thrown into freefall when he begins to lose his hearing.
514,Straight Outta Compton,2015,147 ,"Biography, Drama, History",7.8,72,209246,$161.20M,"The rap group NWA emerges from the mean streets of Compton in Los Angeles, California, in the mid-1980s and revolutionizes Hip Hop culture with their music and tales about life in the hood."
515,Adaptation.,2002,115 ,"Comedy, Drama",7.7,83,197195,$22.25M,A lovelorn screenwriter becomes desperate as he tries and fails to adapt 'The Orchid Thief' by Susan Orlean for the screen.
516,Rebel Without a Cause,1955,111 ,Drama,7.6,89,94049,,"A rebellious young man with a troubled past comes to a new town, finding friends and enemies."
517,I Am Sam,2001,132 ,Drama,7.6,28,152463,$40.31M,A mentally handicapped man fights for custody of his 7-year-old daughter and in the process teaches his cold-hearted lawyer the value of love and family.
518,Before Sunset,2004,80 ,"Drama, Romance",8.1,90,274094,$5.82M,"Nine years after Jesse and Celine first met, they encounter each other again on the French leg of Jesse's book tour."
519,The Fall,2006,117 ,"Adventure, Drama, Fantasy",7.8,64,114334,$2.28M,"In a hospital on the outskirts of 1920s Los Angeles, an injured stuntman begins to tell a fellow patient, a little girl with a broken arm, a fantastic story of five mythical heroes. Thanks to his fractured state of mind and her vivid imagination, the line between fiction and reality blurs as the tale advances."
520,Lion,2016,118 ,"Biography, Drama",8.0,69,242708,$51.74M,"A five-year-old Indian boy is adopted by an Australian couple after getting lost hundreds of kilometers from home. 25 years later, he sets out to find his lost family."
521,The Conversation,1974,113 ,"Drama, Mystery, Thriller",7.8,87,115904,$4.42M,"A paranoid, secretive surveillance expert has a crisis of conscience when he suspects that the couple he is spying on will be murdered."
522,Paddington 2,2017,103 ,"Adventure, Comedy, Family",7.8,88,85060,$40.44M,"Paddington, now happily settled with the Brown family and a popular member of the local community, picks up a series of odd jobs to buy the perfect present for his Aunt Lucy's 100th birthday, only for the gift to be stolen."
523,Being John Malkovich,1999,113 ,"Comedy, Drama, Fantasy",7.7,90,344094,$22.86M,A puppeteer discovers a portal that leads literally into the head of movie star John Malkovich.
524,Nosferatu,1922,94 ,"Fantasy, Horror",7.9,0,100818,,Vampire Count Orlok expresses interest in a new residence and real estate agent Hutter's wife.
525,Dark Waters,2019,126 ,"Biography, Drama, History",7.6,73,93804,,A corporate defense attorney takes on an environmental lawsuit against a chemical company that exposes a lengthy history of pollution.
526,Network,1976,121 ,Drama,8.1,83,163582,#222,"A television network cynically exploits a deranged former anchor's ravings and revelations about the news media for its own profit, but finds that his message may be difficult to control."
527,The Seventh Seal,1957,96 ,"Drama, Fantasy",8.1,88,189983,#205,"A knight returning to Sweden after the Crusades seeks answers about life, death, and the existence of God as he plays chess against the Grim Reaper during the Black Plague."
528,The Theory of Everything,2014,123 ,"Biography, Drama, Romance",7.7,71,463950,$35.89M,A look at the relationship between the famous physicist Stephen Hawking and his wife.
529,Ran,1985,162 ,"Action, Drama, War",8.2,97,129246,$4.14M,"In Medieval Japan, an elderly warlord retires, handing over his empire to his three sons. However, he vastly underestimates how the new-found power will corrupt them and cause them to turn on each other...and him."
530,How to Train Your Dragon 2,2014,102 ,"Animation, Action, Adventure",7.8,77,347850,$177.00M,"When Hiccup and Toothless discover an ice cave that is home to hundreds of new wild dragons and the mysterious Dragon Rider, the two friends find themselves at the center of a battle to protect the peace."
531,Tumbbad,2018,104 ,"Drama, Fantasy, Horror",8.2,0,53096,,A mythological story about a goddess who created the entire universe. The plot revolves around the consequences when humans build a temple for her first-born.
532,Sling Blade,1996,135 ,Drama,8.0,84,96158,$24.48M,"Karl Childers, a simple man hospitalized since his childhood murder of his mother and her lover, is released to start a new life in a small town."
533,Glengarry Glen Ross,1992,100 ,"Crime, Drama, Mystery",7.7,82,110365,$10.73M,An examination of the machinations behind the scenes at a real estate office.
534,Bound by Honor,1993,180 ,"Crime, Drama",7.9,47,32673,$4.50M,"Based on the true life experiences of poet Jimmy Santiago Baca, the film focuses on step-brothers Paco and Cruz, and their bi-racial cousin Miklo."
535,The Night of the Hunter,1955,92 ,"Crime, Drama, Film-Noir",8.0,97,92404,$0.65M,"A religious fanatic marries a gullible widow whose young children are reluctant to tell him where their real daddy hid the $10,000 he'd stolen in a robbery."
536,Fiddler on the Roof,1971,181 ,"Drama, Family, Musical",8.0,67,45488,$80.50M,"In pre-revolutionary Russia, a Jewish peasant with traditional values contends with marrying off three of his daughters with modern romantic ideals while growing anti-Semitic sentiment threatens his village."
537,Annie Hall,1977,93 ,"Comedy, Romance",8.0,92,270441,$39.20M,"Alvy Singer, a divorced Jewish comedian, reflects on his relationship with ex-lover Annie Hall, an aspiring nightclub singer, which ended abruptly just like his previous marriages."
538,The Girl with the Dragon Tattoo,2009,152 ,"Crime, Drama, Mystery",7.8,76,219637,$10.10M,A journalist is aided by a young female hacker in his search for the killer of a woman who has been dead for forty years.
539,Die Hard with a Vengeance,1995,128 ,"Action, Adventure, Thriller",7.6,58,396072,$100.01M,"John McClane and a Harlem store owner are targeted by German terrorist Simon in New York City, where he plans to rob the Federal Reserve Building."
540,The Remains of the Day,1993,134 ,"Drama, Romance",7.8,86,78616,$22.95M,A butler who sacrificed body and soul to service in the years leading up to World War II realizes too late how misguided his loyalty was to his lordly employer.
541,Star Trek II: The Wrath of Khan,1982,113 ,"Action, Adventure, Sci-Fi",7.7,68,125270,$78.91M,"With the assistance of the Enterprise crew, Admiral Kirk must stop an old nemesis, Khan Noonien Singh, from using the life-generating Genesis Device as the ultimate weapon."
542,The Nightmare Before Christmas,1993,76 ,"Animation, Family, Fantasy",7.9,82,351764,$75.08M,"Jack Skellington, king of Halloween Town, discovers Christmas Town, but his attempts to bring Christmas to his home causes confusion."
