,Movie Name,Year of Release,Runtime,Genre,Movie Rating,Metascore of Movie,Votes,Gross,Description
659,The Lion in Winter,1968,134 ,"Biography, Drama, History",7.9,0,32633,$22.28M,"1183 A.D.: King Henry II's three sons all want to inherit the throne, but he won't commit to a choice. When he allows his imprisoned wife Eleanor of Aquitaine out for a Christmas visit, they all variously plot to force him into a decision."
660,Miller's Crossing,1990,115 ,"Crime, Drama, Thriller",7.7,66,138313,$5.08M,"Tom Reagan, an advisor to a Prohibition-era crime boss, tries to keep the peace between warring mobs but gets caught in divided loyalties."
661,All About Eve,1950,138 ,Drama,8.2,98,134116,$0.01M,A seemingly timid but secretly ruthless ingénue insinuates herself into the lives of an aging Broadway star and her circle of theater friends.
662,Paper Moon,1973,102 ,"Comedy, Crime, Drama",8.1,77,49785,$30.93M,"During the Great Depression, a con man finds himself saddled with a young girl who may or may not be his daughter, and the two forge an unlikely partnership."
663,Gaslight,1944,114 ,"Crime, Drama, Mystery",7.8,78,31329,,"Ten years after her aunt was murdered in their London home, a woman returns from Italy in the 1880s to resume residence with her new husband. His obsessive interest in the home rises from a secret that may require driving his wife insane."
664,Badlands,1973,94 ,"Action, Crime, Drama",7.7,93,75354,,"An impressionable teenage girl from a dead-end town, and her older greaser boyfriend, embark on a killing spree in the South Dakota Badlands."
665,Gandhi,1982,191 ,"Biography, Drama, History",8.0,79,236256,$52.77M,The life of the lawyer who became the famed leader of the Indian revolts against the British rule through his philosophy of nonviolent protest.
666,Sing Street,2016,106 ,"Comedy, Drama, Music",7.9,79,97328,$3.24M,A boy growing up in Dublin during the 1980s escapes his strained family life by starting a band to impress the mysterious girl he likes.
667,Barton Fink,1991,116 ,"Comedy, Drama, Thriller",7.6,69,125380,$6.15M,A renowned New York playwright is enticed to California to write for the movies and discovers the hellish truth of Hollywood.
668,C.R.A.Z.Y.,2005,129 ,"Comedy, Drama",7.9,81,33514,,"A young French Canadian, one of five boys in a conservative family in the 1960s and 1970s, struggles to reconcile his emerging identity with his father's values."
669,What Ever Happened to Baby Jane?,1962,134 ,"Drama, Horror, Thriller",8.0,75,58823,$4.05M,A former child star torments her paraplegic sister in their decaying Hollywood mansion.
670,The Day the Earth Stood Still,1951,92 ,"Drama, Sci-Fi",7.8,83,83643,,"An alien lands in Washington, D.C. and tells the people of Earth that they must live peacefully or be destroyed as a danger to other planets."
671,Vikram Vedha,2017,147 ,"Action, Crime, Drama",8.2,0,47716,,"Vikram, a no-nonsense police officer, accompanied by Simon, his partner, is on the hunt to capture Vedha, a smuggler and a murderer. Vedha tries to change Vikram's life, which leads to a conflict."
672,The Day of the Jackal,1973,143 ,"Crime, Drama, Thriller",7.8,80,42574,$16.06M,"In the aftermath of France allowing Algeria's independence, a group of resentful military veterans hire a professional assassin codenamed ""Jackal"" to kill President Charles de Gaulle."
673,The Grapes of Wrath,1940,129 ,Drama,8.1,96,96181,$0.06M,"An Oklahoma family, driven off their farm by the poverty and hopelessness of the Dust Bowl, joins the westward migration to California, suffering the misfortunes of the homeless in the Great Depression."
674,Dangal,2016,161 ,"Action, Biography, Drama",8.3,0,197460,$12.39M,Former wrestler Mahavir Singh Phogat and his two wrestler daughters struggle towards glory at the Commonwealth Games in the face of societal oppression.
675,Secrets & Lies,1996,136 ,"Comedy, Drama",8.0,91,45107,$13.42M,"Following the death of her adoptive parents, a successful young black optometrist establishes contact with her biological mother -- a lonely white factory worker living in poverty in East London."
676,Wolfwalkers,2020,103 ,"Animation, Action, Adventure",8.0,87,35203,,A young apprentice hunter and her father journey to Ireland to help wipe out the last wolf pack. But everything changes when she befriends a free-spirited girl from a mysterious tribe rumored to transform into wolves by night.
677,Andhadhun,2018,139 ,"Crime, Mystery, Thriller",8.2,0,97241,$1.37M,"A series of mysterious events change the life of a blind pianist, who must now report a crime that he should technically know nothing of."
678,"I, Daniel Blake",2016,100 ,Drama,7.8,78,62087,$0.26M,"After surviving a heart-attack, a 59-year-old carpenter must fight bureaucratic forces to receive Employment and Support Allowance."
679,Once Were Warriors,1994,102 ,"Crime, Drama",7.9,77,35506,$2.20M,A family descended from Maori warriors is bedeviled by a violent father and the societal problems of being treated as outcasts.
680,Mirror,1975,107 ,"Biography, Drama",8.0,82,49230,$0.18M,"A dying man in his forties remembers his past. His childhood, his mother, the war, personal moments and things that tell of the recent history of all the Russian nation."
681,Guess Who's Coming to Dinner,1967,108 ,"Comedy, Drama",7.8,63,46956,$56.70M,A couple's attitudes are challenged when their daughter introduces them to her African-American fiancé.
682,Zulu,1964,138 ,"Drama, History, War",7.7,77,40923,,Outnumbered British soldiers do battle with Zulu warriors at Rorke's Drift.
683,Mary and Max,2009,92 ,"Animation, Comedy, Drama",8.1,0,180862,#201,"A tale of friendship between two unlikely pen pals: Mary, a lonely, eight-year-old girl living in the suburbs of Melbourne, and Max, a forty-four-year old, severely obese man living in New York."
684,A Christmas Story,1983,93 ,"Comedy, Family",7.9,77,160870,$20.61M,"In the 1940s, a young boy named Ralphie Parker attempts to convince his parents, teacher, and Santa Claus that a Red Ryder Range 200 Shot BB gun really is the perfect Christmas gift."
685,Kind Hearts and Coronets,1949,106 ,"Comedy, Crime",8.0,0,38533,,A distant poor relative of the Duke D'Ascoyne plots to inherit the title by murdering the eight other heirs who stand ahead of him in the line of succession.
686,It Happened One Night,1934,105 ,"Comedy, Romance",8.1,87,107350,$4.36M,"A renegade reporter trailing a young runaway heiress for a big story joins her on a bus heading from Florida to New York, and they end up stuck with each other when the bus leaves them behind at one of the stops."
687,The Vanishing,1988,107 ,"Mystery, Thriller",7.7,0,40978,,"Rex and Saskia, a young couple in love, are on vacation. They stop at a busy service station and Saskia is abducted. After three years and no sign of Saskia, Rex begins receiving letters from the abductor."
688,The Straight Story,1999,112 ,"Biography, Drama",8.0,86,93219,$6.20M,An old man makes a long journey by lawnmower to mend his relationship with an ill brother.
689,King Kong,1933,100 ,"Adventure, Horror, Sci-Fi",7.9,92,87939,$10.00M,"A film crew goes to a tropical island for a location shoot, where they capture a colossal ape who takes a shine to their blonde starlet, and bring him back to New York City."
690,Me and Earl and the Dying Girl,2015,105 ,"Comedy, Drama, Romance",7.7,74,134700,$6.74M,"High schooler Greg, who spends most of his time making parodies of classic movies with his co-worker Earl, finds his outlook forever altered after befriending a classmate who has just been diagnosed with cancer."
691,Anatomy of a Murder,1959,161 ,"Drama, Mystery",8.0,95,68434,$11.90M,"An upstate Michigan lawyer defends a soldier who claims he killed an innkeeper due to temporary insanity after the victim raped his wife. What is the truth, and will he win his case?"
692,Whisper of the Heart,1995,111 ,"Animation, Drama, Family",7.8,75,66669,,"A love story between a girl who loves reading books, and a boy who has previously checked out all of the library books she chooses."
693,Yojimbo,1961,110 ,"Action, Drama, Thriller",8.2,93,125923,#146,A crafty ronin comes to a town divided by two criminal gangs and decides to play them against each other to free the town.
694,Rope,1948,80 ,"Crime, Drama, Mystery",7.9,73,147909,,Two men attempt to prove they committed the perfect crime by hosting a dinner party after strangling their former classmate to death.
695,Three Colors: Blue,1993,94 ,"Drama, Music, Mystery",7.9,87,106111,$1.32M,A woman struggles to find a way to live her life after the death of her husband and child.
696,Loving Vincent,2017,94 ,"Animation, Drama, Mystery",7.8,62,60433,$6.74M,"In a story depicted in oil painted animation, a young man comes to the last hometown of painter Vincent van Gogh to deliver the troubled artist's final letter and ends up investigating his final days there."
697,Neon Genesis Evangelion: The End of Evangelion,1997,87 ,"Animation, Action, Drama",8.1,0,58630,,Concurrent theatrical ending of the TV series Neon Genesis Evangelion (1995).
698,PK,2014,153 ,"Comedy, Drama, Sci-Fi",8.1,0,193201,$10.62M,An alien on Earth loses the only device he can use to communicate with his spaceship. His innocent nature and child-like questions force the country to evaluate the impact of there religious views on there people.
699,Nebraska,2013,115 ,Drama,7.7,86,120330,$17.65M,"An aging, booze-addled father makes the trip from Montana to Nebraska with his estranged son in order to claim a million-dollar Mega Sweepstakes Marketing prize."
700,The Manchurian Candidate,1962,126 ,"Drama, Thriller",7.9,94,77271,,An American POW in the Korean War is brainwashed as an unwitting assassin for an international Communist conspiracy.
701,Baahubali: The Beginning,2015,159 ,"Action, Drama",8.0,0,130031,$6.74M,"In ancient India, an adventurous and daring man becomes involved in a decades-old feud between two warring peoples."
702,Breaking the Waves,1996,159 ,Drama,7.8,81,69233,$4.04M,"Oilman Jan is paralyzed in an accident. His wife, who prayed for his return, feels guilty; even more, when Jan urges her to have sex with another."
703,Jai Bhim,2021,164 ,"Crime, Drama, Mystery",8.8,0,206928,#234,"When a tribal man is arrested for a case of alleged theft, his wife turns to a human-rights lawyer to help bring justice."
704,Red River,1948,133 ,"Drama, Western",7.8,96,32648,,"Dunson leads a cattle drive, the culmination of over 14 years of work, to its destination in Missouri. But his tyrannical behavior along the way causes a mutiny, led by his adopted son."
705,Miracle in Cell No. 7,2019,132 ,Drama,8.2,0,51697,,A story of love between a mentally-ill father who was wrongly accused of murder and his lovely six year old daughter. Prison will be their home. Based on the 2013 Korean movie Miracle in Cell No. 7 (2013).
706,The Treasure of the Sierra Madre,1948,126 ,"Adventure, Drama, Western",8.2,98,127987,$5.01M,Two down-on-their-luck Americans searching for work in 1920s Mexico convince an old prospector to help them mine for gold in the Sierra Madre Mountains.
707,Freaks,1932,64 ,"Drama, Horror",7.8,80,48316,$0.63M,"A circus' beautiful trapeze artist agrees to marry the leader of side-show performers, but his deformed friends discover she is only marrying him for his inheritance."
708,25th Hour,2002,135 ,Drama,7.6,69,181684,$13.06M,"Cornered by the DEA, convicted New York drug dealer Montgomery Brogan reevaluates his life in the 24 remaining hours before facing a seven-year jail term."
709,Rashomon,1950,88 ,"Crime, Drama, Mystery",8.2,98,172817,$0.10M,"The rape of a bride and the murder of her samurai husband are recalled from the perspectives of a bandit, the bride, the samurai's ghost and a woodcutter."
710,The Killing,1956,84 ,"Crime, Drama, Film-Noir",7.9,91,92703,,Crook Johnny Clay assembles a five-man team to plan and execute a daring racetrack robbery.
711,Happy Together,1997,96 ,"Drama, Romance",7.7,70,31669,$0.19M,A couple take a trip to Argentina but both men find their lives drifting apart in opposite directions.
712,Harold and Maude,1971,91 ,"Comedy, Drama, Romance",7.9,62,79559,,"Young, rich, and obsessed with death, Harold finds himself changed forever when he meets lively septuagenarian Maude at a funeral."
713,Touch of Evil,1958,95 ,"Crime, Drama, Film-Noir",8.0,99,106977,$2.24M,"A stark, perverse story of murder, kidnapping and police corruption in a Mexican border town."
714,Ayla: The Daughter of War,2017,125 ,"Biography, Drama, History",8.3,0,41579,,"Sergeant Süleyman finds a little girl on a battlefield during the Korean War. He takes her and names her Ayla. Fifteen months later, Süleyman's brigade is told they will be returning to Turkey, and he is reluctant to leave her behind."
715,Manhattan,1979,96 ,"Comedy, Drama, Romance",7.8,83,143088,$45.70M,The life of a divorced television writer dating a teenage girl is further complicated when he falls in love with his best friend's mistress.
716,Once Upon a Time in Anatolia,2011,157 ,"Crime, Drama, Thriller",7.8,82,47932,$0.14M,A group of men set out in search of a dead body in the Anatolian steppes.
717,Talk to Her,2002,112 ,"Drama, Mystery, Romance",7.9,86,114975,$9.36M,Two men share an odd friendship while they care for two women who are both in deep comas.
718,High and Low,1963,143 ,"Crime, Drama, Mystery",8.4,90,47856,#86,An executive of a Yokohama shoe company becomes a victim of extortion when his chauffeur's son is kidnapped by mistake and held for ransom.
719,Cat on a Hot Tin Roof,1958,108 ,Drama,7.9,84,51457,$17.57M,Brick is an alcoholic ex-football player who drinks his days away and resists the affections of his wife. A reunion with his terminal father jogs a host of memories and revelations for both father and son.
720,Sita Ramam,2022,163 ,"Action, Drama, Mystery",8.6,0,60063,,"An orphan soldier, Lieutenant Ram's life changes, after he gets a letter from a girl named Sita. He meets her and love blossoms between them. When he comes back to his camp in Kashmir,After he gets caught in jail, he sends a letter to Sita which won't reach her."
721,All About My Mother,1999,101 ,Drama,7.8,87,99682,$8.26M,"Pedro Almodovar's Oscar-winning comedy (Best Foreign Film, 1999) about a bereaved mother, and overwrought actress, her jealous lover and a pregnant nun."
722,United 93,2006,111 ,"Action, Drama, History",7.6,90,108426,$31.57M,"A real-time account of the events on United Flight 93, one of the planes hijacked on September 11th, 2001 that crashed near Shanksville, Pennsylvania when passengers foiled the terrorist plot."
723,The Chaser,2008,125 ,"Action, Crime, Drama",7.8,64,69229,,A disgraced ex-policeman who runs a small ring of prostitutes finds himself in a race against time when one of his women goes missing.
724,Z,1969,127 ,"Crime, Drama, Thriller",8.2,86,29995,$0.08M,The public murder of a prominent politician and doctor amid a violent demonstration is covered up by military and government officials. A tenacious magistrate is determined not to let them get away with it.
725,The Cabinet of Dr. Caligari,1920,67 ,"Horror, Mystery, Thriller",8.0,0,66658,,"Hypnotist Dr. Caligari uses a somnambulist, Cesare, to commit murders."
726,The Legend of 1900,1998,169 ,"Drama, Music, Romance",8.0,58,66667,$0.26M,"A baby boy discovered on an ocean liner in 1900 grows into a musical prodigy, never setting foot on land."
727,Modern Times,1936,87 ,"Comedy, Drama, Romance",8.5,96,248470,$0.16M,The Tramp struggles to live in modern industrial society with the help of a young homeless woman.
728,Porco Rosso,1992,94 ,"Animation, Adventure, Comedy",7.7,83,94300,,"In 1930s Italy, a veteran World War I pilot is cursed to look like an anthropomorphic pig."
729,Fitzcarraldo,1982,158 ,"Adventure, Drama",8.0,0,36478,,"The story of Brian Sweeney Fitzgerald, an extremely determined man who intends to build an opera house in the middle of a jungle."
730,Amour,2012,127 ,Drama,7.9,95,102959,$6.74M,"Georges and Anne are an octogenarian couple. They are cultivated, retired music teachers. Their daughter, also a musician, lives in Britain with her family. One day, Anne has a stroke, and the couple's bond of love is severely tested."
731,The Philadelphia Story,1940,112 ,"Comedy, Romance",7.9,96,71495,,"When a rich woman's ex-husband and a tabloid-type reporter turn up just before her planned remarriage, she begins to learn the truth about herself."
732,Breathless,1960,90 ,"Crime, Drama",7.7,0,84718,$0.34M,"A small-time thief steals a car and impulsively murders a motorcycle policeman. Wanted by the authorities, he reunites with a hip American journalism student and attempts to persuade her to run away with him to Italy."
733,Ninja Scroll,1993,94 ,"Animation, Action, Adventure",7.8,0,38900,,A vagabond swordsman is aided by a kunoichi and a spy in battling a demonic clan of killers - led by a ghost from his past - who are bent on overthrowing the Tokugawa Shogunate.
734,Beasts of No Nation,2015,137 ,"Drama, War",7.7,79,84031,$0.08M,"A drama based on the experiences of Agu, a child soldier fighting in the civil war of an unnamed African country."
735,Three Colors: Red,1994,99 ,"Drama, Mystery, Romance",8.1,100,106370,$4.04M,A model discovers a retired judge is keen on invading people's privacy.
736,A Taxi Driver,2017,137 ,"Action, Drama, History",7.9,69,27453,$1.53M,"A widowed father and taxi driver who drives a German reporter from Seoul to Gwangju to cover the 1980 uprising, soon finds himself regretting his decision after being caught in the violence around him."
737,Waking Life,2001,99 ,"Animation, Drama, Fantasy",7.7,83,65594,$2.89M,A man shuffles through a dream meeting various people and discussing the meanings and purposes of the universe.
738,Drishyam,2015,163 ,"Crime, Drama, Mystery",8.2,0,88595,$0.74M,"Desperate measures are taken by a man who tries to save his family from the dark side of the law, after they commit an unexpected crime."
739,Short Cuts,1993,188 ,"Comedy, Drama",7.7,81,46154,$6.11M,The day-to-day lives of several suburban Los Angeles residents.
740,Invasion of the Body Snatchers,1956,80 ,"Drama, Horror, Sci-Fi",7.7,92,52209,,A small-town doctor learns that the population of his community is being replaced by emotionless alien duplicates.
741,The Little Prince,2015,108 ,"Animation, Adventure, Drama",7.7,70,64237,$1.34M,"A little girl lives in a very grown-up world with her mother, who tries to prepare her for it. Her neighbor, the Aviator, introduces the girl to an extraordinary world where anything is possible, the world of the Little Prince."
742,The 400 Blows,1959,99 ,"Crime, Drama",8.1,0,122215,#243,"A young boy, left without attention, delves into a life of petty crime."
743,Mildred Pierce,1945,111 ,"Crime, Drama, Film-Noir",7.9,88,27385,,A hard-working mother inches towards disaster as she divorces her husband and starts a successful restaurant business to support her spoiled daughter.
744,Strangers on a Train,1951,101 ,"Crime, Drama, Film-Noir",7.9,88,136943,$7.63M,A psychopath forces a tennis star to comply with his theory that two strangers can get away with murder.
745,The Taking of Pelham One Two Three,1974,104 ,"Action, Crime, Thriller",7.6,68,32964,$2.49M,"Four armed men hijack a New York City subway car and demand a ransom for the passengers. The city's police are faced with a conundrum: Even if it's paid, how could they get away?"
746,Cape Fear,1962,106 ,"Drama, Thriller",7.7,76,30403,,A lawyer's family is stalked by a man he once helped put in jail.
747,Inherit the Wind,1960,128 ,"Biography, Drama, History",8.1,75,31454,,"Based on a real-life case in 1925, two great lawyers argue the case for and against a Tennessee science teacher accused of the crime of teaching evolution."
748,The Adventures of Robin Hood,1938,102 ,"Action, Adventure, Romance",7.9,97,52843,$3.98M,"When Prince John and the Norman Lords begin oppressing the Saxon masses in King Richard's absence in 1190s England, a Saxon lord fights back as the outlaw leader of a resistance movement."
749,Wild Strawberries,1957,91 ,"Drama, Romance",8.1,88,110057,#190,"After living a life marked by coldness, an aging professor is forced to confront the emptiness of his existence."
750,The Hustler,1961,134 ,"Drama, Sport",8.0,90,84212,$8.28M,An up-and-coming pool player plays a long-time champion in a single high-stakes match.
751,Dersu Uzala,1975,142 ,"Adventure, Biography, Drama",8.2,0,31914,,The Russian army sends an explorer on an expedition to the snowy Siberian wilderness where he makes friends with a seasoned local hunter.
752,Key Largo,1948,100 ,"Action, Crime, Drama",7.7,0,42574,,"A man visits his war buddy's family hotel and finds a gangster running things. As a hurricane approaches, the two end up confronting each other."
753,City Lights,1931,87 ,"Comedy, Drama, Romance",8.5,99,188646,$0.02M,"With the aid of a wealthy erratic tippler, a dewy-eyed tramp who has fallen in love with a sightless flower girl accumulates money to be able to help her medically."
754,Land of Mine,2015,100 ,"Drama, History, War",7.8,75,43293,$0.44M,"In post-World War II Denmark, a group of young German POWs are forced to clear a beach of thousands of land mines under the watch of a Danish Sergeant who slowly learns to appreciate their plight."
755,Short Term 12,2013,96 ,Drama,7.9,82,89607,$1.01M,A 20-something supervising staff member of a residential treatment facility navigates the troubled waters of that world alongside her co-worker and longtime boyfriend.
756,The Double Life of Véronique,1991,98 ,"Drama, Fantasy, Music",7.7,86,50793,$2.00M,"Two parallel stories about two identical women; one living in Poland, the other in France. They don't know each other, but their lives are nevertheless profoundly connected."
757,Bicycle Thieves,1948,89 ,Drama,8.3,0,167662,$0.33M,"In post-war Italy, a working-class man's bicycle is stolen, endangering his efforts to find work. He and his son set out to find it."
758,Batman: Mask of the Phantasm,1993,76 ,"Animation, Action, Adventure",7.8,65,53558,$5.62M,Batman is wrongly implicated in a series of murders of mob bosses actually done by a new vigilante assassin.
759,Nobody Knows,2004,141 ,Drama,8.0,88,29423,$0.68M,"In a small Tokyo apartment, twelve-year-old Akira must care for his younger siblings after their mother leaves them and shows no sign of returning."
760,Stalag 17,1953,120 ,"Comedy, Drama, War",8.0,84,57111,,"After two Americans are killed while escaping from a German P.O.W. camp in World War II, the barracks black marketeer, J.J. Sefton, is suspected of being an informer."
761,Open Your Eyes,1997,119 ,"Drama, Mystery, Sci-Fi",7.7,0,71165,$0.37M,"A very handsome man finds the love of his life, but he suffers an accident and needs to have his face rebuilt by surgery after it is severely disfigured."
762,Night on Earth,1991,129 ,"Comedy, Drama",7.7,68,62933,$2.02M,An anthology of 5 different cab drivers in 5 American and European cities and their remarkable fares on the same eventful night.
763,Good Bye Lenin!,2003,121 ,"Comedy, Drama, Romance",7.7,68,149283,$4.06M,"In 1990, to protect his fragile mother from a fatal shock after a long coma, a young man must keep her from learning that her beloved nation of East Germany as she knew it has disappeared."
764,The World's Fastest Indian,2005,127 ,"Biography, Drama, Sport",7.8,68,56516,$5.13M,"The story of New Zealander Burt Munro, who spent years rebuilding a 1920 Indian motorcycle, which helped him set the land speed world record at Utah's Bonneville Salt Flats in 1967."
765,Zindagi Na Milegi Dobara,2011,155 ,"Comedy, Drama, Musical",8.2,0,81464,$3.11M,Three friends decide to turn their fantasy vacation into reality after one of their friends gets engaged.
766,Arsenic and Old Lace,1944,118 ,"Comedy, Crime, Thriller",7.9,0,72756,,A Brooklyn writer of books on the futility of marriage risks his reputation when he decides to tie the knot. Things get even more complicated when he learns on his wedding day that his beloved maiden aunts are habitual murderers.
767,Underground,1995,167 ,"Comedy, Drama, Fantasy",8.1,79,59639,$0.17M,"A group of Serbian socialists prepares for the war in a surreal underground filled by parties, tragedies, love, and hate."
768,A Man for All Seasons,1966,120 ,"Biography, Drama, History",7.7,72,35896,$28.35M,"The story of Sir Thomas More, who stood up to King Henry VIII when the King rejected the Roman Catholic Church to obtain a divorce and remarry."
769,The White Ribbon,2009,144 ,"Drama, Mystery, Thriller",7.8,84,75475,$2.22M,"Strange events happen in a small village in the north of Germany during the years before World War I, which seem to be ritual punishment. Who is responsible?"
770,Frankenstein,1931,70 ,"Drama, Horror, Sci-Fi",7.8,91,75687,,Dr. Frankenstein dares to tamper with life and death by creating a human monster out of lifeless body parts.
771,Uri: The Surgical Strike,2019,138 ,"Action, Drama, History",8.2,0,67422,$4.19M,"Indian army special forces execute a covert operation, avenging the killing of fellow army men at their base by a terrorist group."
772,"Aguirre, the Wrath of God",1972,95 ,"Action, Adventure, Biography",7.8,0,59151,,"In the 16th century, the ruthless and insane Don Lope de Aguirre leads a Spanish expedition in search of El Dorado."
773,The Leopard,1963,186 ,"Drama, History",8.0,100,27346,,"The Prince of Salina, a noble aristocrat of impeccable integrity, tries to preserve his family and class amid the tumultuous social upheavals of 1860s Sicily."
774,Shadow of a Doubt,1943,108 ,"Film-Noir, Thriller",7.8,94,67779,,"A teenage girl, overjoyed when her favorite uncle comes to visit the family in their quiet California town, slowly begins to suspect that he is in fact the ""Merry Widow"" killer sought by the authorities."
