,Movie Name,Year of Release,Runtime,Genre,Movie Rating,Metascore of Movie,Votes,Gross,Description
0,Spider-Man: Across the Spider-Verse,2023,140 ,"Animation, Action, Adventure",9.1,86,54090,#15,"Miles Morales catapults across the Multiverse, where he encounters a team of Spider-People charged with protecting its very existence. When the heroes clash on how to handle a new threat, Miles must redefine what it means to be a hero."
1,John Wick: Chapter 4,2023,169 ,"Action, Crime, Thriller",8.0,78,191636,,"John Wick uncovers a path to defeating The High Table. But before he can earn his freedom, Wick must face off against a new enemy with powerful alliances across the globe and forces that turn old friends into foes."
2,Guardians of the Galaxy Vol. 3,2023,150 ,"Action, Adventure, Comedy",8.2,64,157604,#160,"Still reeling from the loss of Gamora, Peter Quill rallies his team to defend the universe and one of their own - a mission that could mean the end of the Guardians if not successful."
3,Spider-Man: Into the Spider-Verse,2018,117 ,"Animation, Action, Adventure",8.4,87,572157,$190.24M,Teen Miles Morales becomes the Spider-Man of his universe and must join with five spider-powered individuals from other dimensions to stop a threat for all realities.
4,Top Gun: Maverick,2022,130 ,"Action, Drama",8.3,78,591592,$718.73M,"After thirty years, Maverick is still pushing the envelope as a top naval aviator, but must confront ghosts of his past when he leads TOP GUN's elite graduates on a mission that demands the ultimate sacrifice from those chosen to fly it."
5,The Whale,2022,117 ,Drama,7.7,60,149338,,"A reclusive, morbidly obese English teacher attempts to reconnect with his estranged teenage daughter."
6,Avatar: The Way of Water,2022,192 ,"Action, Adventure, Fantasy",7.7,67,388034,$659.68M,"Jake Sully lives with his newfound family formed on the extrasolar moon Pandora. Once a familiar threat returns to finish what was previously started, Jake must work with Neytiri and the army of the Na'vi race to protect their home."
7,The Godfather,1972,175 ,"Crime, Drama",9.2,100,1910994,$134.97M,"Don Vito Corleone, head of a mafia family, decides to hand over his empire to his youngest son Michael. However, his decision unintentionally puts the lives of his loved ones in grave danger."
8,Everything Everywhere All at Once,2022,139 ,"Action, Adventure, Comedy",7.8,81,450542,$72.86M,A middle-aged Chinese immigrant is swept up into an insane adventure in which she alone can save existence by exploring other universes and connecting with the lives she could have led.
9,The Shawshank Redemption,1994,142 ,Drama,9.3,82,2747561,$28.34M,"Over the course of several years, two convicts form a friendship, seeking consolation and, eventually, redemption through basic compassion."
10,Guardians of the Galaxy,2014,121 ,"Action, Adventure, Comedy",8.0,76,1219807,$333.18M,A group of intergalactic criminals must pull together to stop a fanatical warrior with plans to purge the universe.
11,Indiana Jones and the Raiders of the Lost Ark,1981,115 ,"Action, Adventure",8.4,85,987343,$248.16M,"In 1936, archaeologist and adventurer Indiana Jones is hired by the U.S. government to find the Ark of the Covenant before the Nazis can obtain its awesome powers."
12,Interstellar,2014,169 ,"Adventure, Drama, Sci-Fi",8.7,74,1912608,$188.02M,"When Earth becomes uninhabitable in the future, a farmer and ex-NASA pilot, Joseph Cooper, is tasked to pilot a spacecraft, along with a team of researchers, to find a new planet for humans."
13,Harry Potter and the Sorcerer's Stone,2001,152 ,"Adventure, Family, Fantasy",7.6,65,809994,$317.58M,"An orphaned boy enrolls in a school of wizardry, where he learns the truth about himself, his family and the terrible evil that haunts the magical world."
14,Heat,1995,170 ,"Action, Crime, Drama",8.3,76,677037,$67.44M,A group of high-end professional thieves start to feel the heat from the LAPD when they unknowingly leave a clue at their latest heist.
15,Dune,2021,155 ,"Action, Adventure, Drama",8.0,74,679697,$108.33M,A noble family becomes embroiled in a war for control over the galaxy's most valuable asset while its heir becomes troubled by visions of a dark future.
16,Spider-Man: No Way Home,2021,148 ,"Action, Adventure, Fantasy",8.2,71,798547,$804.75M,"With Spider-Man's identity now revealed, Peter asks Doctor Strange for help. When a spell goes wrong, dangerous foes from other worlds start to appear, forcing Peter to discover what it truly means to be Spider-Man."
17,Goodfellas,1990,145 ,"Biography, Crime, Drama",8.7,92,1192511,$46.84M,"The story of Henry Hill and his life in the mafia, covering his relationship with his wife Karen and his mob partners Jimmy Conway and Tommy DeVito."
18,The Batman,2022,176 ,"Action, Crime, Drama",7.8,72,701043,$369.35M,"When a sadistic serial killer begins murdering key political figures in Gotham, Batman is forced to investigate the city's hidden corruption and question his family's involvement."
19,Guardians of the Galaxy Vol. 2,2017,136 ,"Action, Adventure, Comedy",7.6,67,716449,$389.81M,"The Guardians struggle to keep together as a team while dealing with their personal family issues, notably Star-Lord's encounter with his father, the ambitious celestial being Ego."
20,The Wolf of Wall Street,2013,180 ,"Biography, Comedy, Crime",8.2,75,1464442,$116.90M,"Based on the true story of Jordan Belfort, from his rise to a wealthy stock-broker living the high life to his fall involving crime, corruption and the federal government."
21,Inception,2010,148 ,"Action, Adventure, Sci-Fi",8.8,74,2414675,$292.58M,"A thief who steals corporate secrets through the use of dream-sharing technology is given the inverse task of planting an idea into the mind of a C.E.O., but his tragic past may doom the project and his team to disaster."
22,Once Upon a Time in Hollywood,2019,161 ,"Comedy, Drama",7.6,83,778767,$142.50M,A faded television actor and his stunt double strive to achieve fame and success in the final years of Hollywood's Golden Age in 1969 Los Angeles.
23,The Dark Knight,2008,152 ,"Action, Crime, Drama",9.0,84,2720248,$534.86M,"When the menace known as the Joker wreaks havoc and chaos on the people of Gotham, Batman must accept one of the greatest psychological and physical tests of his ability to fight injustice."
24,Pulp Fiction,1994,154 ,"Crime, Drama",8.9,95,2111148,$107.93M,"The lives of two mob hitmen, a boxer, a gangster and his wife, and a pair of diner bandits intertwine in four tales of violence and redemption."
25,Puss in Boots: The Last Wish,2022,102 ,"Animation, Adventure, Comedy",7.9,73,131254,$168.46M,"When Puss in Boots discovers that his passion for adventure has taken its toll and he has burned through eight of his nine lives, he launches an epic journey to restore them by finding the mythical Last Wish."
26,Titanic,1997,194 ,"Drama, Romance",7.9,75,1219849,$659.33M,"A seventeen-year-old aristocrat falls in love with a kind but poor artist aboard the luxurious, ill-fated R.M.S. Titanic."
27,Hacksaw Ridge,2016,139 ,"Biography, Drama, History",8.1,71,550325,$67.21M,"World War II American Army Medic Desmond T. Doss, who served during the Battle of Okinawa, refuses to kill people and becomes the first man in American history to receive the Medal of Honor without firing a shot."
28,Avengers: Endgame,2019,181 ,"Action, Adventure, Drama",8.4,78,1181448,$858.37M,"After the devastating events of Avengers: Infinity War (2018), the universe is in ruins. With the help of remaining allies, the Avengers assemble once more in order to reverse Thanos' actions and restore balance to the universe."
29,American Psycho,2000,102 ,"Crime, Drama, Horror",7.6,64,656933,$15.07M,"A wealthy New York City investment banking executive, Patrick Bateman, hides his alternate psychopathic ego from his co-workers and friends as he delves deeper into his violent, hedonistic fantasies."
30,Jurassic Park,1993,127 ,"Action, Adventure, Sci-Fi",8.2,68,1014533,$402.45M,A pragmatic paleontologist touring an almost complete theme park on an island in Central America is tasked with protecting a couple of kids after a power failure causes the park's cloned dinosaurs to run loose.
31,Blade Runner 2049,2017,164 ,"Action, Drama, Mystery",8.0,81,604498,$92.05M,"Young Blade Runner K's discovery of a long-buried secret leads him to track down former Blade Runner Rick Deckard, who's been missing for thirty years."
32,Parasite,2019,132 ,"Drama, Thriller",8.5,96,855968,$53.37M,Greed and class discrimination threaten the newly formed symbiotic relationship between the wealthy Park family and the destitute Kim clan.
33,The Lord of the Rings: The Fellowship of the Ring,2001,178 ,"Action, Adventure, Drama",8.8,92,1916863,$315.54M,A meek Hobbit from the Shire and eight companions set out on a journey to destroy the powerful One Ring and save Middle-earth from the Dark Lord Sauron.
34,The Green Mile,1999,189 ,"Crime, Drama, Fantasy",8.6,61,1336018,$136.80M,"A tale set on death row in a Southern jail, where gentle giant John possesses the mysterious power to heal people's ailments. When the lead guard, Paul, recognizes John's gift, he tries to help stave off the condemned man's execution."
35,Fight Club,1999,139 ,Drama,8.8,66,2187936,$37.03M,An insomniac office worker and a devil-may-care soap maker form an underground fight club that evolves into much more.
36,The Banshees of Inisherin,2022,114 ,"Comedy, Drama",7.7,87,210190,,"Two lifelong friends find themselves at an impasse when one abruptly ends their relationship, with alarming consequences for both of them."
37,Mad Max: Fury Road,2015,120 ,"Action, Adventure, Sci-Fi",8.1,90,1030852,$154.06M,"In a post-apocalyptic wasteland, a woman rebels against a tyrannical ruler in search for her homeland with the aid of a group of female prisoners, a psychotic worshiper and a drifter named Max."
38,The Departed,2006,151 ,"Crime, Drama, Thriller",8.5,85,1357130,$132.38M,An undercover cop and a mole in the police attempt to identify each other while infiltrating an Irish gang in South Boston.
39,Saving Private Ryan,1998,169 ,"Drama, War",8.6,91,1424268,$216.54M,"Following the Normandy Landings, a group of U.S. soldiers go behind enemy lines to retrieve a paratrooper whose brothers have been killed in action."
40,Whiplash,2014,106 ,"Drama, Music",8.5,89,905565,$13.09M,A promising young drummer enrolls at a cut-throat music conservatory where his dreams of greatness are mentored by an instructor who will stop at nothing to realize a student's potential.
41,Inglourious Basterds,2009,153 ,"Adventure, Drama, War",8.3,69,1492999,$120.54M,"In Nazi-occupied France during World War II, a plan to assassinate Nazi leaders by a group of Jewish U.S. soldiers coincides with a theatre owner's vengeful plans for the same."
42,Aftersun,2022,102 ,Drama,7.7,95,63760,,Sophie reflects on the shared joy and private melancholy of a holiday she took with her father twenty years earlier. Memories real and imagined fill the gaps between as she tries to reconcile the father she knew with the man she didn't...
43,The Breakfast Club,1985,97 ,"Comedy, Drama",7.8,66,414332,$45.88M,Five high school students meet in Saturday detention and discover how they have a great deal more in common than they thought.
44,Tombstone,1993,130 ,"Biography, Drama, History",7.8,50,156094,$56.51M,"A successful lawman's plans to retire anonymously in Tombstone, Arizona are disrupted by the kind of outlaws he was famous for eliminating."
45,Forrest Gump,1994,142 ,"Drama, Romance",8.8,82,2137630,$330.25M,"The presidencies of Kennedy and Johnson, the Vietnam War, the Watergate scandal and other historical events unfold from the perspective of an Alabama man with an IQ of 75, whose only desire is to be reunited with his childhood sweetheart."
46,Back to the Future,1985,116 ,"Adventure, Comedy, Sci-Fi",8.5,87,1239675,$210.61M,"Marty McFly, a 17-year-old high school student, is accidentally sent 30 years into the past in a time-traveling DeLorean invented by his close friend, the maverick scientist Doc Brown."
47,The Gentlemen,2019,113 ,"Action, Comedy, Crime",7.8,51,360990,$36.47M,"An American expat tries to sell off his highly profitable marijuana empire in London, triggering plots, schemes, bribery and blackmail in an attempt to steal his domain out from under him."
48,Good Will Hunting,1997,126 ,"Drama, Romance",8.3,70,1004559,$138.43M,"Will Hunting, a janitor at M.I.T., has a gift for mathematics, but needs help from a psychologist to find direction in his life."
49,Kingsman: The Secret Service,2014,129 ,"Action, Adventure, Comedy",7.7,60,687026,$128.26M,"A spy organisation recruits a promising street kid into the agency's training program, while a global threat emerges from a twisted tech genius."
50,Indiana Jones and the Last Crusade,1989,127 ,"Action, Adventure",8.2,65,771734,$197.17M,"In 1938, after his father goes missing while pursuing the Holy Grail, Indiana Jones finds himself up against the Nazis again to stop them from obtaining its powers."
51,Harry Potter and the Goblet of Fire,2005,157 ,"Adventure, Family, Fantasy",7.7,81,647374,$290.01M,"Harry Potter finds himself competing in a hazardous tournament between rival schools of magic, but he is distracted by recurring nightmares."
52,Se7en,1995,127 ,"Crime, Drama, Mystery",8.6,65,1698927,$100.13M,"Two detectives, a rookie and a veteran, hunt a serial killer who uses the seven deadly sins as his motives."
53,Apocalypse Now,1979,147 ,"Drama, Mystery, War",8.4,94,682540,$83.47M,A U.S. Army officer serving in Vietnam is tasked with assassinating a renegade Special Forces Colonel who sees himself as a god.
54,The Matrix,1999,136 ,"Action, Sci-Fi",8.7,73,1959114,$171.48M,"When a beautiful stranger leads computer hacker Neo to a forbidding underworld, he discovers the shocking truth--the life he knows is the elaborate deception of an evil cyber-intelligence."
55,All Quiet on the Western Front,2022,148 ,"Action, Drama, War",7.8,76,206403,,A young German soldier's terrifying experiences and distress on the western front during World War I.
56,Schindler's List,1993,195 ,"Biography, Drama, History",9.0,95,1385927,$96.90M,"In German-occupied Poland during World War II, industrialist Oskar Schindler gradually becomes concerned for his Jewish workforce after witnessing their persecution by the Nazis."
57,The Silence of the Lambs,1991,118 ,"Crime, Drama, Thriller",8.6,86,1468484,$130.74M,"A young F.B.I. cadet must receive the help of an incarcerated and manipulative cannibal killer to help catch another serial killer, a madman who skins his victims."
58,Black Swan,2010,108 ,"Drama, Thriller",8.0,79,789210,$106.95M,"Nina is a talented but unstable ballerina on the verge of stardom. Pushed to the breaking point by her artistic director and a seductive rival, Nina's grip on reality slips, plunging her into a waking nightmare."
59,Alien,1979,117 ,"Horror, Sci-Fi",8.5,89,903871,$78.90M,The crew of a commercial spacecraft encounter a deadly lifeform after investigating an unknown transmission.
60,The Godfather Part II,1974,202 ,"Crime, Drama",9.0,90,1301759,$57.30M,"The early life and career of Vito Corleone in 1920s New York City is portrayed, while his son, Michael, expands and tightens his grip on the family crime syndicate."
61,Pride & Prejudice,2005,129 ,"Drama, Romance",7.8,82,308331,$38.41M,"Sparks fly when spirited Elizabeth Bennet meets single, rich, and proud Mr. Darcy. But Mr. Darcy reluctantly finds himself falling in love with a woman beneath his class. Can each overcome their own pride and prejudice?"
62,Prisoners,2013,153 ,"Crime, Drama, Mystery",8.1,70,746666,$61.00M,"When Keller Dover's daughter and her friend go missing, he takes matters into his own hands as the police pursue multiple leads and the pressure mounts."
63,Léon: The Professional,1994,110 ,"Action, Crime, Drama",8.5,64,1190122,$19.50M,"12-year-old Mathilda is reluctantly taken in by Léon, a professional assassin, after her family is murdered. An unusual relationship forms as she becomes his protégée and learns the assassin's trade."
64,Taxi Driver,1976,114 ,"Crime, Drama",8.2,94,864801,$28.26M,"A mentally unstable veteran works as a nighttime taxi driver in New York City, where the perceived decadence and sleaze fuels his urge for violent action."
65,Django Unchained,2012,165 ,"Drama, Western",8.4,81,1600530,$162.81M,"With the help of a German bounty-hunter, a freed slave sets out to rescue his wife from a brutal plantation owner in Mississippi."
66,The Goonies,1985,114 ,"Adventure, Comedy, Family",7.7,62,285113,$61.50M,A group of young misfits called The Goonies discover an ancient map and set out on an adventure to find a legendary pirate's long-lost treasure.
67,Knives Out,2019,130 ,"Comedy, Crime, Drama",7.9,82,727886,$165.36M,"A detective investigates the death of the patriarch of an eccentric, combative family."
68,Requiem for a Dream,2000,102 ,Drama,8.3,71,862111,$3.64M,The drug-induced utopias of four Coney Island people are shattered when their addictions run deep.
69,Shutter Island,2010,138 ,"Mystery, Thriller",8.2,63,1362129,$128.01M,"Teddy Daniels and Chuck Aule, two US marshals, are sent to an asylum on a remote island in order to investigate the disappearance of a patient, where Teddy uncovers a shocking truth about the place."
70,Joker,2019,122 ,"Crime, Drama, Thriller",8.4,59,1355936,$335.45M,"The rise of Arthur Fleck, from aspiring stand-up comedian and pariah to Gotham's clown prince and leader of the revolution."
71,The Grand Budapest Hotel,2014,99 ,"Adventure, Comedy, Crime",8.1,88,839402,$59.10M,"A writer encounters the owner of an aging high-class hotel, who tells him of his early years serving as a lobby boy in the hotel's glorious years under an exceptional concierge."
72,Gladiator,2000,155 ,"Action, Adventure, Drama",8.5,67,1537083,$187.71M,A former Roman General sets out to exact vengeance against the corrupt emperor who murdered his family and sent him into slavery.
73,Star Wars: Episode IV - A New Hope,1977,121 ,"Action, Adventure, Fantasy",8.6,90,1394408,$322.74M,"Luke Skywalker joins forces with a Jedi Knight, a cocky pilot, a Wookiee and two droids to save the galaxy from the Empire's world-destroying battle station, while also attempting to rescue Princess Leia from the mysterious Darth Vader."
74,Jaws,1975,124 ,"Adventure, Mystery, Thriller",8.1,87,624510,$260.00M,"When a killer shark unleashes chaos on a beach community off Cape Cod, it's up to a local sheriff, a marine biologist, and an old seafarer to hunt the beast down."
75,The Prestige,2006,130 ,"Drama, Mystery, Sci-Fi",8.5,66,1365347,$53.09M,"After a tragic accident, two stage magicians in 1890s London engage in a battle to create the ultimate illusion while sacrificing everything they have to outwit each other."
76,No Country for Old Men,2007,122 ,"Crime, Drama, Thriller",8.2,92,1002294,$74.28M,Violence and mayhem ensue after a hunter stumbles upon a drug deal gone wrong and more than two million dollars in cash near the Rio Grande.
77,Avengers: Infinity War,2018,149 ,"Action, Adventure, Sci-Fi",8.4,68,1124756,$678.82M,The Avengers and their allies must be willing to sacrifice all in an attempt to defeat the powerful Thanos before his blitz of devastation and ruin puts an end to the universe.
78,Pirates of the Caribbean: The Curse of the Black Pearl,2003,143 ,"Action, Adventure, Fantasy",8.1,63,1154325,$305.41M,"Blacksmith Will Turner teams up with eccentric pirate ""Captain"" Jack Sparrow to save his love, the governor's daughter, from Jack's former pirate allies, who are now undead."
79,Deadpool 2,2018,119 ,"Action, Adventure, Comedy",7.6,66,605823,$324.59M,"Foul-mouthed mutant mercenary Wade Wilson (a.k.a. Deadpool) assembles a team of fellow mutant rogues to protect a young boy with supernatural abilities from the brutal, time-traveling cyborg Cable."
80,Casablanca,1942,102 ,"Drama, Romance, War",8.5,100,583816,$1.02M,A cynical expatriate American cafe owner struggles to decide whether or not to help his former lover and her fugitive husband escape the Nazis in French Morocco.
81,Harry Potter and the Prisoner of Azkaban,2004,142 ,"Adventure, Family, Fantasy",7.9,82,656073,$249.36M,"Harry Potter, Ron and Hermione return to Hogwarts School of Witchcraft and Wizardry for their third year of study, where they delve into the mystery surrounding an escaped prisoner who poses a dangerous threat to the young wizard."
82,Avatar,2009,162 ,"Action, Adventure, Fantasy",7.9,83,1342636,$760.51M,A paraplegic Marine dispatched to the moon Pandora on a unique mission becomes torn between following his orders and protecting the world he feels is his home.
83,Scarface,1983,170 ,"Crime, Drama",8.3,65,866771,$45.60M,"In 1980 Miami, a determined Cuban immigrant takes over a drug cartel and succumbs to greed."
84,Deadpool,2016,108 ,"Action, Comedy",8.0,65,1068645,$363.07M,"A wisecracking mercenary gets experimented on and becomes immortal but ugly, and sets out to track down the man who ruined his looks."
85,Blade Runner,1982,117 ,"Action, Drama, Sci-Fi",8.1,84,788398,$32.87M,A blade runner must pursue and terminate four replicants who stole a ship in space and have returned to Earth to find their creator.
86,The Fifth Element,1997,126 ,"Action, Adventure, Sci-Fi",7.6,52,486370,$63.54M,"In the colorful future, a cab driver unwittingly becomes the central figure in the search for a legendary cosmic weapon to keep Evil and Mr. Zorg at bay."
87,The Hangover,2009,100 ,Comedy,7.7,73,808436,$277.32M,"Three buddies wake up from a bachelor party in Las Vegas, with no memory of the previous night and the bachelor missing. They make their way around the city in order to find their friend before his wedding."
88,American Beauty,1999,122 ,Drama,8.3,84,1174011,$130.10M,A sexually frustrated suburban father has a mid-life crisis after becoming infatuated with his daughter's best friend.
89,The Princess Bride,1987,98 ,"Adventure, Comedy, Family",8.0,77,436245,$30.86M,"A bedridden boy's grandfather reads him the story of a farmboy-turned-pirate who encounters numerous obstacles, enemies and allies in his quest to be reunited with his true love."
90,Harry Potter and the Deathly Hallows: Part 2,2011,130 ,"Adventure, Family, Fantasy",8.1,85,901177,$381.01M,"Harry, Ron, and Hermione search for Voldemort's remaining Horcruxes in their effort to destroy the Dark Lord as the final battle rages on at Hogwarts."
91,The Irishman,2019,209 ,"Biography, Crime, Drama",7.8,94,404214,$7.00M,"An illustration of Frank Sheeran's life, from W.W.II veteran to hit-man for the Bufalino crime family and his alleged assassination of his close friend Jimmy Hoffa."
92,Oldboy,2003,120 ,"Action, Drama, Mystery",8.4,77,596808,$0.71M,"After being kidnapped and imprisoned for fifteen years, Oh Dae-Su is released, only to find that he must find his captor in five days."
93,Black Hawk Down,2001,144 ,"Action, Drama, History",7.7,74,407525,$108.64M,"The story of 160 elite U.S. soldiers who dropped into Mogadishu in October 1993 to capture two top lieutenants of a renegade warlord, but found themselves in a desperate battle with a large force of heavily armed Somalis."
94,The Shining,1980,146 ,"Drama, Horror",8.4,66,1049871,$44.02M,"A family heads to an isolated hotel for the winter where a sinister presence influences the father into violence, while his psychic son sees horrific forebodings from both past and future."
95,Iron Man,2008,126 ,"Action, Adventure, Sci-Fi",7.9,79,1083112,$318.41M,"After being held captive in an Afghan cave, billionaire engineer Tony Stark creates a unique weaponized suit of armor to fight evil."
96,Call Me by Your Name,2017,132 ,"Drama, Romance",7.8,94,288807,$18.10M,"In 1980s Italy, romance blossoms between a seventeen-year-old student and the older man hired as his father's research assistant."
97,Little Women,2019,135 ,"Drama, Romance",7.8,91,219475,$108.10M,"Jo March reflects back and forth on her life, telling the beloved story of the March sisters - four young women, each determined to live life on her own terms."
98,North by Northwest,1959,136 ,"Action, Adventure, Mystery",8.3,98,334759,$13.28M,"A New York City advertising executive goes on the run after being mistaken for a government agent by a group of foreign spies, and falls for a woman whose loyalties he begins to doubt."
99,Gone Girl,2014,149 ,"Drama, Mystery, Thriller",8.1,79,1009227,$167.77M,"With his wife's disappearance having become the focus of an intense media circus, a man sees the spotlight turned on him when it's suspected that he may not be innocent."
100,The Lord of the Rings: The Return of the King,2003,201 ,"Action, Adventure, Drama",9.0,94,1888247,$377.85M,Gandalf and Aragorn lead the World of Men against Sauron's army to draw his gaze from Frodo and Sam as they approach Mount Doom with the One Ring.
101,2001: A Space Odyssey,1968,149 ,"Adventure, Sci-Fi",8.3,84,685866,$56.95M,"After uncovering a mysterious artifact buried beneath the Lunar surface, a spacecraft is sent to Jupiter to find its origins - a spacecraft manned by two men and the supercomputer H.A.L. 9000."
102,12 Angry Men,1957,96 ,"Crime, Drama",9.0,97,813568,$4.36M,The jury in a New York City murder trial is frustrated by a single member whose skeptical caution forces them to more carefully consider the evidence before jumping to a hasty verdict.
103,Ford v Ferrari,2019,152 ,"Action, Biography, Drama",8.1,81,419475,$117.62M,American car designer Carroll Shelby and driver Ken Miles battle corporate interference and the laws of physics to build a revolutionary race car for Ford in order to defeat Ferrari at the 24 Hours of Le Mans in 1966.
