,Movie Name,Year of Release,Runtime,Genre,Movie Rating,Metascore of Movie,Votes,Gross,Description
434,The Raid: Redemption,2011,101 ,"Action, Crime, Thriller",7.6,73,210280,$4.11M,A S.W.A.T. team becomes trapped in a tenement run by a ruthless mobster and his army of killers and thugs.
435,The Hobbit: The Desolation of Smaug,2013,161 ,Fantasy,7.8,66,679208,$258.37M,"The dwarves, along with Bilbo Baggins and Gandalf the Grey, continue their quest to reclaim Erebor, their homeland, from Smaug. Bilbo Baggins is in possession of a mysterious and magical ring."
436,North by Northwest,1959,136 ,"Action, Adventure, Mystery",8.3,98,334745,$13.28M,"A New York City advertising executive goes on the run after being mistaken for a government agent by a group of foreign spies, and falls for a woman whose loyalties he begins to doubt."
437,Brazil,1985,132 ,"Drama, Sci-Fi",7.9,84,205264,$9.93M,A bureaucrat in a dystopic society becomes an enemy of the state as he pursues the woman of his dreams.
438,The Trial of the Chicago 7,2020,129 ,"Drama, History, Thriller",7.7,76,184214,,"The story of 7 people on trial stemming from various charges surrounding the uprising at the 1968 Democratic National Convention in Chicago, Illinois."
439,Dawn of the Planet of the Apes,2014,130 ,"Action, Adventure, Drama",7.6,79,451878,$208.55M,The fragile peace between apes and humans is threatened as mistrust and betrayal threaten to plunge both tribes into a war for dominance over the Earth.
440,The Iron Giant,1999,86 ,"Animation, Action, Adventure",8.1,85,209339,$23.16M,A young boy befriends a giant robot from outer space that a paranoid government agent wants to destroy.
441,When Harry Met Sally...,1989,95 ,"Comedy, Drama, Romance",7.7,76,228570,$92.82M,"Harry and Sally have known each other for years, and are very good friends, but they fear sex would ruin the friendship."
442,Misery,1990,107 ,"Drama, Thriller",7.8,75,221143,$61.28M,"After a famous author is rescued from a car crash by a fan of his novels, he comes to realize that the care he is receiving is only the beginning of a nightmare of captivity and abuse."
443,Cinema Paradiso,1988,155 ,"Drama, Romance",8.5,80,268627,$11.99M,A filmmaker recalls his childhood when falling in love with the pictures at the cinema of his home village and forms a deep friendship with the cinema's projectionist.
444,Thirteen Lives,2022,147 ,"Action, Adventure, Biography",7.8,66,60777,,A rescue mission is assembled in Thailand where a group of young boys and their soccer coach are trapped in a system of underground caves that are flooding.
445,The Fighter,2010,116 ,"Action, Biography, Drama",7.8,79,377159,$93.62M,"Based on the story of Micky Ward, a fledgling boxer who tries to escape the shadow of his more famous but troubled older boxing brother and get his own shot at greatness."
446,Kung Fu Hustle,2004,99 ,"Action, Comedy, Fantasy",7.7,78,144598,$17.11M,"In Shanghai, China in the 1940s, a wannabe gangster aspires to join the notorious ""Axe Gang"" while residents of a housing complex exhibit extraordinary powers in defending their turf."
447,JFK,1991,189 ,"Drama, History, Thriller",8.0,72,162031,$70.41M,New Orleans District Attorney Jim Garrison discovers there's more to the Kennedy assassination than the official story.
448,What We Do in the Shadows,2014,86 ,"Comedy, Horror",7.6,76,190278,$3.33M,"Viago, Deacon, and Vladislav are vampires who are struggling with the mundane aspects of modern life, like paying rent, keeping up with the chore wheel, trying to get into nightclubs, and overcoming flatmate conflicts."
449,The Mitchells vs the Machines,2021,114 ,"Animation, Adventure, Comedy",7.6,81,116060,,"A quirky, dysfunctional family's road trip is upended when they find themselves in the middle of the robot apocalypse and suddenly become humanity's unlikeliest last hope."
450,All the President's Men,1976,138 ,"Drama, History, Thriller",7.9,84,120231,$70.60M,"""The Washington Post"" reporters Bob Woodward and Carl Bernstein uncover the details of the Watergate scandal that leads to President Richard Nixon's resignation."
451,Midnight Cowboy,1969,113 ,Drama,7.8,79,115079,$44.79M,"A naive hustler travels from Texas to New York City to seek personal fortune, finding a new friend in the process."
452,"Crouching Tiger, Hidden Dragon",2000,120 ,"Action, Adventure, Drama",7.9,94,275728,$128.08M,A young Chinese warrior steals a sword from a famed swordsman and then escapes into a world of romantic adventure with a mysterious man in the frontier of the nation.
453,Gravity,2013,91 ,"Drama, Sci-Fi, Thriller",7.7,96,840965,$274.09M,Two astronauts work together to survive after an accident leaves them stranded in space.
454,Young Frankenstein,1974,106 ,Comedy,8.0,83,162850,$86.30M,"An American grandson of the infamous scientist, struggling to prove that his grandfather was not as insane as people believe, is invited to Transylvania, where he discovers the process that reanimates a dead body."
455,The Elephant Man,1980,124 ,"Biography, Drama",8.2,78,248042,#156,"A Victorian surgeon rescues a heavily disfigured man who is mistreated while scraping a living as a side-show freak. Behind his monstrous façade, there is revealed a person of kindness, intelligence and sophistication."
456,Happiness,1998,134 ,"Comedy, Drama",7.7,81,72169,$2.81M,"The lives of several individuals intertwine as they go about their lives in their own unique ways, engaging in acts which society as a whole might find disturbing in a desperate search for human connection."
457,The Invisible Guest,2016,106 ,"Crime, Drama, Mystery",8.0,0,183003,,A successful entrepreneur accused of murder and a witness preparation expert have less than three hours to come up with an impregnable defense.
458,The Boondock Saints,1999,108 ,"Action, Thriller",7.7,44,243503,$0.03M,Two Irish Catholic brothers become vigilantes and wipe out Boston's criminal underworld in the name of God.
459,Moon,2009,97 ,"Drama, Mystery, Sci-Fi",7.8,67,366765,$5.01M,"Astronaut Sam Bell has a quintessentially personal encounter toward the end of his three-year stint on the Moon, where he, working alongside his computer, GERTY, sends back to Earth parcels of a resource that has helped diminish our planet's power problems."
460,Sense and Sensibility,1995,136 ,"Drama, Romance",7.7,84,120214,$43.18M,"Rich Mr. Dashwood dies, leaving his second wife and her three daughters poor by the rules of inheritance. The two eldest daughters are the title opposites."
461,Demon Slayer the Movie: Mugen Train,2020,117 ,"Animation, Action, Adventure",8.2,72,64484,$47.70M,"After his family was brutally murdered and his sister turned into a demon, Tanjiro Kamado's journey as a demon slayer began. Tanjiro and his comrades embark on a new mission aboard the Mugen Train, on track to despair."
462,The Great Escape,1963,172 ,"Adventure, Drama, History",8.2,86,249602,$12.10M,Allied prisoners of war plan for several hundred of their number to escape from a German camp during World War II.
463,Dark Waters,2019,126 ,"Biography, Drama, History",7.6,73,93798,,A corporate defense attorney takes on an environmental lawsuit against a chemical company that exposes a lengthy history of pollution.
464,Naked,1993,131 ,"Comedy, Drama",7.7,85,41542,$1.77M,An unemployed Mancunian vents his rage on unsuspecting strangers as he embarks on a nocturnal London odyssey.
465,"Paris, Texas",1984,145 ,Drama,8.1,81,110694,$2.18M,"Travis Henderson, an aimless drifter who has been missing for four years, wanders out of the desert and must reconnect with society, himself, his life, and his family."
466,Goldfinger,1964,110 ,"Action, Adventure, Thriller",7.7,87,195767,$51.08M,"While investigating a gold magnate's smuggling, James Bond uncovers a plot to contaminate the Fort Knox gold reserve."
467,Chungking Express,1994,102 ,"Comedy, Crime, Drama",8.0,78,88026,$0.60M,"Two melancholy Hong Kong policemen fall in love: one with a mysterious female underworld figure, the other with a beautiful and ethereal waitress at a late-night restaurant he frequents."
468,Das Boot,1981,149 ,"Drama, War",8.4,86,255730,$11.49M,A German U-boat stalks the frigid waters of the North Atlantic as its young crew experience the sheer terror and claustrophobic life of a submariner in World War II.
469,The Secret in Their Eyes,2009,129 ,"Drama, Mystery, Romance",8.2,80,214231,$6.39M,A retired legal counselor writes a novel hoping to find closure for one of his past unresolved homicide cases and for his unreciprocated love with his superior - both of which still haunt him decades later.
470,Road to Perdition,2002,117 ,"Crime, Drama, Thriller",7.7,72,276038,$104.45M,"A mob enforcer's son in 1930s Illinois witnesses a murder, forcing him and his father to take to the road, and his father down a path of redemption and revenge."
471,Ip Man,2008,106 ,"Action, Biography, Drama",8.0,59,228502,,"During the Japanese invasion of China, a wealthy martial artist is forced to leave his home when his city is occupied. With little means of providing for themselves, Ip Man and the remaining members of the city must find a way to survive."
472,The Man from Earth,2007,87 ,"Drama, Fantasy, Mystery",7.9,0,192662,,An impromptu goodbye party for Professor John Oldman becomes a mysterious interrogation after the retiring scholar reveals to his colleagues he has a longer and stranger past than they can imagine.
473,Serpico,1973,130 ,"Biography, Crime, Drama",7.7,81,128199,$29.80M,An honest New York cop named Frank Serpico blows the whistle on rampant corruption in the force only to have his comrades turn against him.
474,The King of Comedy,1982,109 ,"Comedy, Crime, Drama",7.8,73,109550,$2.50M,"Rupert Pupkin is a passionate yet unsuccessful comic who craves nothing more than to be in the spotlight and to achieve this, he stalks and kidnaps his idol to take the spotlight for himself."
475,Toy Story 2,1999,92 ,"Animation, Adventure, Comedy",7.9,88,595907,$245.85M,"When Woody is stolen by a toy collector, Buzz and his friends set out on a rescue mission to save Woody before he becomes a museum toy property with his roundup gang Jessie, Prospector, and Bullseye."
476,Walk the Line,2005,136 ,"Biography, Drama, Music",7.8,72,257443,$119.52M,"A chronicle of country music legend Johnny Cash's life, from his early days on an Arkansas cotton farm to his rise to fame with Sun Records in Memphis, where he recorded alongside Elvis Presley, Jerry Lee Lewis, and Carl Perkins."
477,Fried Green Tomatoes,1991,130 ,Drama,7.7,64,77977,$82.42M,A housewife who is unhappy with her life befriends an old lady at a nursing home and is enthralled by the tales she tells of people she used to know.
478,The Naked Gun: From the Files of Police Squad!,1988,85 ,"Comedy, Crime",7.6,76,175987,$78.76M,Incompetent police Detective Frank Drebin must foil an attempt to assassinate Queen Elizabeth II.
479,End of Watch,2012,109 ,"Action, Adventure, Crime",7.6,68,256852,$41.00M,"Shot documentary-style, this film follows the daily grind of two young police officers in LA who are partners and friends and what happens when they meet criminal forces greater than themselves."
480,A Silent Voice: The Movie,2016,130 ,"Animation, Drama",8.1,78,89844,,"A young man is ostracized by his classmates after he bullies a deaf girl to the point where she moves away. Years later, he sets off on a path for redemption."
481,The Longest Day,1962,178 ,"Action, Drama, History",7.7,75,57454,$39.10M,"The events of D-Day, told on a grand scale from both the Allied and German points of view."
482,The Jungle Book,1967,78 ,"Animation, Adventure, Comedy",7.6,65,190126,$141.84M,Bagheera the Panther and Baloo the Bear have a difficult time trying to convince a boy to leave the jungle for human civilization.
483,Spartacus,1960,197 ,"Adventure, Biography, Drama",7.9,87,138584,$30.00M,"The slave Spartacus survives brutal training as a gladiator and leads a violent revolt against the decadent Roman Republic, as the ambitious Crassus seeks to gain power by crushing the uprising."
484,Metropolis,1927,153 ,"Drama, Sci-Fi",8.3,98,178352,$1.24M,"In a futuristic city sharply divided between the working class and the city planners, the son of the city's mastermind falls in love with a working-class prophet who predicts the coming of a savior to mediate their differences."
485,Carlito's Way,1993,144 ,"Crime, Drama, Thriller",7.9,66,224571,$36.95M,"A Puerto Rican former convict, just released from prison, pledges to stay away from drugs and violence despite the pressure around him and lead on to a better life outside of N.Y.C."
486,Sound of Metal,2019,120 ,"Drama, Music",7.7,82,137128,,A heavy-metal drummer's life is thrown into freefall when he begins to lose his hearing.
487,The Sting,1973,129 ,"Comedy, Crime, Drama",8.3,83,269681,$159.60M,Two grifters team up to pull off the ultimate con.
488,La haine,1995,98 ,"Crime, Drama",8.1,0,181604,$0.31M,24 hours in the lives of three young men in the French suburbs the day after a violent riot.
489,Singin' in the Rain,1952,103 ,"Comedy, Musical, Romance",8.3,99,249068,$8.82M,A silent film star falls for a chorus girl just as he and his delusionally jealous screen partner are trying to make the difficult transition to talking pictures in 1920s Hollywood.
490,Eastern Promises,2007,100 ,"Crime, Drama, Thriller",7.6,83,250782,$17.11M,A teenager who dies during childbirth leaves clues in her journal that could tie her child to a rape involving a violent Russian mob family.
491,Sunset Blvd.,1950,110 ,"Drama, Film-Noir",8.4,94,226973,#60,A screenwriter develops a dangerous relationship with a faded film star determined to make a triumphant return.
492,The Ten Commandments,1956,220 ,"Adventure, Drama, Family",7.9,0,74397,$93.74M,"Moses, raised as a prince of Egypt in the Pharaoh's household, learns of his true heritage as a Hebrew and his divine mission as the deliverer of his people from slavery."
493,Glory,1989,122 ,"Biography, Drama, History",7.8,78,138902,$26.83M,"Robert Gould Shaw leads the U.S. Civil War's first all-black volunteer company, fighting prejudices from both his own Union Army, and the Confederates."
494,Being John Malkovich,1999,113 ,"Comedy, Drama, Fantasy",7.7,90,344082,$22.86M,A puppeteer discovers a portal that leads literally into the head of movie star John Malkovich.
495,Network,1976,121 ,Drama,8.1,83,163577,#222,"A television network cynically exploits a deranged former anchor's ravings and revelations about the news media for its own profit, but finds that his message may be difficult to control."
496,Donnie Brasco,1997,127 ,"Biography, Crime, Drama",7.7,76,317043,$41.91M,"An FBI undercover agent infiltrates the mob and finds himself identifying more with the mafia life, at the expense of his regular one."
497,The Nightmare Before Christmas,1993,76 ,"Animation, Family, Fantasy",7.9,82,351751,$75.08M,"Jack Skellington, king of Halloween Town, discovers Christmas Town, but his attempts to bring Christmas to his home causes confusion."
498,Butch Cassidy and the Sundance Kid,1969,110 ,"Biography, Crime, Drama",8.0,66,220825,$102.31M,"Wyoming, early 1900s. Butch Cassidy and The Sundance Kid are the leaders of a band of outlaws. After a train robbery goes wrong they find themselves on the run with a posse hard on their heels. Their solution - escape to Bolivia."
499,Philadelphia,1993,125 ,Drama,7.7,66,248880,$77.32M,"When a man with HIV is fired by his law firm because of his condition, he hires a homophobic small time lawyer as the only willing advocate for a wrongful dismissal suit."
500,Before Sunset,2004,80 ,"Drama, Romance",8.1,90,274069,$5.82M,"Nine years after Jesse and Celine first met, they encounter each other again on the French leg of Jesse's book tour."
501,The Fall,2006,117 ,"Adventure, Drama, Fantasy",7.8,64,114333,$2.28M,"In a hospital on the outskirts of 1920s Los Angeles, an injured stuntman begins to tell a fellow patient, a little girl with a broken arm, a fantastic story of five mythical heroes. Thanks to his fractured state of mind and her vivid imagination, the line between fiction and reality blurs as the tale advances."
502,Sling Blade,1996,135 ,Drama,8.0,84,96157,$24.48M,"Karl Childers, a simple man hospitalized since his childhood murder of his mother and her lover, is released to start a new life in a small town."
503,Dirty Harry,1971,102 ,"Action, Crime, Thriller",7.7,87,161839,$35.90M,"When a man calling himself ""the Scorpio Killer"" menaces San Francisco, tough-as-nails Police Inspector ""Dirty"" Harry Callahan is assigned to track down the crazed psychopath."
504,Tumbbad,2018,104 ,"Drama, Fantasy, Horror",8.2,0,53088,,A mythological story about a goddess who created the entire universe. The plot revolves around the consequences when humans build a temple for her first-born.
505,Star Trek II: The Wrath of Khan,1982,113 ,"Action, Adventure, Sci-Fi",7.7,68,125266,$78.91M,"With the assistance of the Enterprise crew, Admiral Kirk must stop an old nemesis, Khan Noonien Singh, from using the life-generating Genesis Device as the ultimate weapon."
506,Hunt for the Wilderpeople,2016,101 ,"Adventure, Comedy, Drama",7.8,81,135255,$5.20M,A national manhunt is ordered for a rebellious kid and his foster uncle who go missing in the wild New Zealand bush.
507,The Bourne Supremacy,2004,108 ,"Action, Mystery, Thriller",7.7,73,473724,$176.24M,"When Jason Bourne is framed for a CIA operation gone awry, he is forced to resume his former life as a trained assassin to survive."
508,The Bourne Ultimatum,2007,115 ,"Action, Mystery, Thriller",8.0,85,644303,$227.47M,Jason Bourne dodges a ruthless C.I.A. official and his Agents from a new assassination program while searching for the origins of his life as a trained killer.
509,The Theory of Everything,2014,123 ,"Biography, Drama, Romance",7.7,71,463926,$35.89M,A look at the relationship between the famous physicist Stephen Hawking and his wife.
510,The Wrestler,2008,109 ,"Drama, Sport, Thriller",7.9,80,313042,$26.24M,"A faded professional wrestler must retire, but finds his quest for a new life outside the ring a dispiriting struggle."
511,Ghost in the Shell,1995,83 ,"Animation, Action, Crime",7.9,76,148585,$0.52M,A cyborg policewoman and her partner hunt a mysterious and powerful hacker called the Puppet Master.
512,Ponyo,2008,101 ,"Animation, Adventure, Comedy",7.6,86,151007,$15.09M,"A five-year-old boy develops a relationship with Ponyo, a young goldfish princess who longs to become a human after falling in love with him."
513,Lion,2016,118 ,"Biography, Drama",8.0,69,242706,$51.74M,"A five-year-old Indian boy is adopted by an Australian couple after getting lost hundreds of kilometers from home. 25 years later, he sets out to find his lost family."
514,Lethal Weapon,1987,109 ,"Action, Crime, Thriller",7.6,68,266471,$65.21M,Two newly paired cops who are complete opposites must put aside their differences in order to catch a gang of drug smugglers.
515,Paddington 2,2017,103 ,"Adventure, Comedy, Family",7.8,88,85055,$40.44M,"Paddington, now happily settled with the Brown family and a popular member of the local community, picks up a series of odd jobs to buy the perfect present for his Aunt Lucy's 100th birthday, only for the gift to be stolen."
516,Ben-Hur,1959,212 ,"Adventure, Drama",8.1,90,245233,$74.70M,"After a Jewish prince is betrayed and sent into slavery by a Roman friend in 1st-century Jerusalem, he regains his freedom and comes back for revenge."
517,For a Few Dollars More,1965,132 ,"Drama, Western",8.2,74,262921,$15.00M,Two bounty hunters with the same intentions team up to track down an escaped Mexican outlaw.
518,The Outlaw Josey Wales,1976,135 ,Western,7.8,69,76631,$31.80M,Missouri farmer Josey Wales joins a Confederate guerrilla unit and winds up on the run from the Union soldiers who murdered his family.
519,Ray,2004,152 ,"Biography, Drama, Music",7.7,73,152081,$75.33M,"The story of the life and career of the legendary rhythm and blues musician Ray Charles, from his humble beginnings in the South, where he went blind at age seven, to his meteoric rise to stardom during the 1950s and 1960s."
520,My Left Foot,1989,103 ,"Biography, Drama",7.8,97,76932,$14.74M,"Christy Brown, born with cerebral palsy, learns to paint and write with his only controllable limb - his left foot."
521,Ordinary People,1980,124 ,Drama,7.7,86,54444,$54.80M,"The accidental death of the older son of an affluent family deeply strains the relationships among the bitter mother, the good-natured father and the guilt-ridden younger son."
522,Glengarry Glen Ross,1992,100 ,"Crime, Drama, Mystery",7.7,82,110363,$10.73M,An examination of the machinations behind the scenes at a real estate office.
523,The Searchers,1956,119 ,"Adventure, Drama, Western",7.9,94,92717,,An American Civil War veteran embarks on a years-long journey to rescue his niece from the Comanches after the rest of his brother's family is massacred in a raid on their Texas farm.
524,The Day the Earth Stood Still,1951,92 ,"Drama, Sci-Fi",7.8,83,83640,,"An alien lands in Washington, D.C. and tells the people of Earth that they must live peacefully or be destroyed as a danger to other planets."
525,Clerks,1994,92 ,Comedy,7.7,70,227357,$3.15M,"A day in the lives of two convenience clerks named Dante and Randal as they annoy customers, discuss movies, and play hockey on the store roof."
526,High Noon,1952,85 ,"Drama, Thriller, Western",8.0,89,106964,$9.45M,"A town Marshal, despite the disagreements of his newlywed bride and the townspeople around him, must face a gang of deadly killers alone at ""high noon"" when the gang leader, an outlaw he ""sent up"" years ago, arrives on the noon train."
527,Rebel Without a Cause,1955,111 ,Drama,7.6,89,94045,,"A rebellious young man with a troubled past comes to a new town, finding friends and enemies."
528,Snow White and the Seven Dwarfs,1937,83 ,"Animation, Adventure, Family",7.6,96,206111,$184.93M,"Exiled into the dangerous forest by her wicked stepmother, a princess is rescued by seven dwarf miners who make her part of their household."
529,Ran,1985,162 ,"Action, Drama, War",8.2,97,129241,$4.14M,"In Medieval Japan, an elderly warlord retires, handing over his empire to his three sons. However, he vastly underestimates how the new-found power will corrupt them and cause them to turn on each other...and him."
530,The Insider,1999,157 ,"Biography, Drama, Thriller",7.8,84,175016,$28.97M,A research chemist comes under personal and professional attack when he decides to appear in a 60 Minutes exposé on Big Tobacco.
531,Baahubali: The Beginning,2015,159 ,"Action, Drama",8.0,0,130022,$6.74M,"In ancient India, an adventurous and daring man becomes involved in a decades-old feud between two warring peoples."
532,The Conversation,1974,113 ,"Drama, Mystery, Thriller",7.8,87,115903,$4.42M,"A paranoid, secretive surveillance expert has a crisis of conscience when he suspects that the couple he is spying on will be murdered."
533,On the Waterfront,1954,108 ,"Crime, Drama, Thriller",8.1,91,158573,$9.60M,"An ex-prize fighter turned New Jersey longshoreman struggles to stand up to his corrupt union bosses, including his older brother, as he starts to connect with the grieving sister of one of the syndicate's victims."
534,Match Point,2005,124 ,"Drama, Romance, Thriller",7.6,72,222507,$23.09M,"At a turning point in his life, a former tennis pro falls for an actress who happens to be dating his friend and soon-to-be brother-in-law."
535,Enter the Dragon,1973,102 ,"Action, Crime, Drama",7.6,83,107796,$25.00M,A Shaolin martial artist travels to an island fortress to spy on an opium lord - who is also a former monk from his temple - under the guise of attending a fighting tournament.
536,Papillon,1973,151 ,"Biography, Crime, Drama",8.0,58,134225,$53.27M,"A French convict in the 1930s befriends a fellow criminal as the two of them begin serving their sentence in the South American penal colony on Devil's Island, which inspires the man to plot his escape."
537,A Fistful of Dollars,1964,99 ,"Action, Drama, Western",7.9,65,223525,$14.50M,"A wandering gunfighter plays two rival families against each other in a town torn apart by greed, pride, and revenge."
538,The Girl with the Dragon Tattoo,2009,152 ,"Crime, Drama, Mystery",7.8,76,219635,$10.10M,A journalist is aided by a young female hacker in his search for the killer of a woman who has been dead for forty years.
539,Bonnie and Clyde,1967,111 ,"Action, Biography, Crime",7.7,86,116541,,"Bored waitress Bonnie Parker falls in love with an ex-con named Clyde Barrow and together they start a violent crime spree through the country, stealing cars and robbing banks."
540,Kiki's Delivery Service,1989,103 ,"Animation, Family, Fantasy",7.8,85,152016,,"A young witch, on her mandatory year of independent life, finds fitting into a new community difficult while she supports herself by running an air courier service."
541,The Apartment,1960,125 ,"Comedy, Drama, Romance",8.3,94,186684,$18.60M,"A Manhattan insurance clerk tries to rise in his company by letting its executives use his apartment for trysts, but complications and a romance of his own ensue."
542,The Best Offer,2013,131 ,"Crime, Drama, Mystery",7.8,49,123422,$0.09M,A lonely art expert working for a mysterious and reclusive heiress finds not only her art worth examining.
543,The Name of the Rose,1986,130 ,"Drama, Mystery, Thriller",7.7,54,111942,$7.15M,An intellectually nonconformist friar investigates a series of mysterious deaths in an isolated abbey.
544,Doctor Zhivago,1965,197 ,"Drama, Romance, War",7.9,69,79392,$111.72M,"The life of a Russian physician and poet who, although married to another, falls in love with a political activist's wife and experiences hardship during World War I and then the October Revolution."
