,Movie Name,Year of Release,Runtime,Genre,Movie Rating,Metascore of Movie,Votes,Gross,Description
663,The Night of the Hunter,1955,92 ,"Crime, Drama, Film-Noir",8.0,97,92398,$0.65M,"A religious fanatic marries a gullible widow whose young children are reluctant to tell him where their real daddy hid the $10,000 he'd stolen in a robbery."
664,Vikram Vedha,2017,147 ,"Action, Crime, Drama",8.2,0,47713,,"Vikram, a no-nonsense police officer, accompanied by Simon, his partner, is on the hunt to capture Vedha, a smuggler and a murderer. Vedha tries to change Vikram's life, which leads to a conflict."
665,Kramer vs. Kramer,1979,105 ,Drama,7.8,77,149531,$106.26M,"After his wife leaves him, a work-obsessed Manhattan advertising executive is forced to learn long-neglected parenting skills, but a heated custody battle over the couple's young son deepens the wounds left by the separation."
666,Andhadhun,2018,139 ,"Crime, Mystery, Thriller",8.2,0,97230,$1.37M,"A series of mysterious events change the life of a blind pianist, who must now report a crime that he should technically know nothing of."
667,Cat on a Hot Tin Roof,1958,108 ,Drama,7.9,84,51455,$17.57M,Brick is an alcoholic ex-football player who drinks his days away and resists the affections of his wife. A reunion with his terminal father jogs a host of memories and revelations for both father and son.
668,Notorious,1946,102 ,"Drama, Film-Noir, Romance",7.9,100,103691,$10.46M,The daughter of a convicted Nazi spy is asked by American agents to gather information on a ring of Nazi scientists in South America. How far will she have to go to ingratiate herself with them?
669,Dial M for Murder,1954,105 ,"Crime, Thriller",8.2,75,180667,$0.01M,A former tennis star arranges the murder of his adulterous wife.
670,King Kong,1933,100 ,"Adventure, Horror, Sci-Fi",7.9,92,87936,$10.00M,"A film crew goes to a tropical island for a location shoot, where they capture a colossal ape who takes a shine to their blonde starlet, and bring him back to New York City."
671,Brief Encounter,1945,86 ,"Drama, Romance",8.0,92,41892,,"Meeting a stranger in a railway station, a woman is tempted to cheat on her husband."
672,The Grapes of Wrath,1940,129 ,Drama,8.1,96,96178,$0.06M,"An Oklahoma family, driven off their farm by the poverty and hopelessness of the Dust Bowl, joins the westward migration to California, suffering the misfortunes of the homeless in the Great Depression."
673,High and Low,1963,143 ,"Crime, Drama, Mystery",8.4,90,47851,#86,An executive of a Yokohama shoe company becomes a victim of extortion when his chauffeur's son is kidnapped by mistake and held for ransom.
674,Neon Genesis Evangelion: The End of Evangelion,1997,87 ,"Animation, Action, Drama",8.1,0,58621,,Concurrent theatrical ending of the TV series Neon Genesis Evangelion (1995).
675,Baahubali 2: The Conclusion,2017,167 ,"Action, Drama",8.2,0,106781,$20.19M,"When Shiva, the son of Bahubali, learns about his heritage, he begins to look for answers. His story is juxtaposed with past events that unfolded in the Mahishmati Kingdom."
676,Wolfwalkers,2020,103 ,"Animation, Action, Adventure",8.0,87,35201,,A young apprentice hunter and her father journey to Ireland to help wipe out the last wolf pack. But everything changes when she befriends a free-spirited girl from a mysterious tribe rumored to transform into wolves by night.
677,Barton Fink,1991,116 ,"Comedy, Drama, Thriller",7.6,69,125379,$6.15M,A renowned New York playwright is enticed to California to write for the movies and discovers the hellish truth of Hollywood.
678,The Philadelphia Story,1940,112 ,"Comedy, Romance",7.9,96,71490,,"When a rich woman's ex-husband and a tabloid-type reporter turn up just before her planned remarriage, she begins to learn the truth about herself."
679,Guess Who's Coming to Dinner,1967,108 ,"Comedy, Drama",7.8,63,46956,$56.70M,A couple's attitudes are challenged when their daughter introduces them to her African-American fiancé.
680,Klaus,2019,96 ,"Animation, Adventure, Comedy",8.2,65,166320,#180,"A simple act of kindness always sparks another, even in a frozen, faraway place. When Smeerensburg's new postman, Jesper, befriends toymaker Klaus, their gifts melt an age-old feud and deliver a sleigh full of holiday traditions."
681,Mildred Pierce,1945,111 ,"Crime, Drama, Film-Noir",7.9,88,27383,,A hard-working mother inches towards disaster as she divorces her husband and starts a successful restaurant business to support her spoiled daughter.
682,The Straight Story,1999,112 ,"Biography, Drama",8.0,86,93218,$6.20M,An old man makes a long journey by lawnmower to mend his relationship with an ill brother.
683,Kubo and the Two Strings,2016,101 ,"Animation, Action, Adventure",7.7,84,133712,$48.02M,A young boy named Kubo must locate a magical suit of armour worn by his late father in order to defeat a vengeful spirit from the past.
684,My Name Is Khan,2010,165 ,"Adventure, Drama, Romance",7.9,50,110914,$4.02M,An Indian Muslim man with Asperger's syndrome takes a challenge to speak to the President of the United States seriously and embarks on a cross-country journey.
685,Red River,1948,133 ,"Drama, Western",7.8,96,32648,,"Dunson leads a cattle drive, the culmination of over 14 years of work, to its destination in Missouri. But his tyrannical behavior along the way causes a mutiny, led by his adopted son."
686,The Lion in Winter,1968,134 ,"Biography, Drama, History",7.9,0,32633,$22.28M,"1183 A.D.: King Henry II's three sons all want to inherit the throne, but he won't commit to a choice. When he allows his imprisoned wife Eleanor of Aquitaine out for a Christmas visit, they all variously plot to force him into a decision."
687,East of Eden,1955,118 ,Drama,7.8,72,47132,,"Two brothers in 1910s California struggle to maintain their strict, Bible-toting father's favor as an old secret about their long-absent mother comes to light."
688,Me and Earl and the Dying Girl,2015,105 ,"Comedy, Drama, Romance",7.7,74,134691,$6.74M,"High schooler Greg, who spends most of his time making parodies of classic movies with his co-worker Earl, finds his outlook forever altered after befriending a classmate who has just been diagnosed with cancer."
689,It Happened One Night,1934,105 ,"Comedy, Romance",8.1,87,107344,$4.36M,"A renegade reporter trailing a young runaway heiress for a big story joins her on a bus heading from Florida to New York, and they end up stuck with each other when the bus leaves them behind at one of the stops."
690,The Killing,1956,84 ,"Crime, Drama, Film-Noir",7.9,91,92697,,Crook Johnny Clay assembles a five-man team to plan and execute a daring racetrack robbery.
691,Kaithi,2019,145 ,"Action, Adventure, Crime",8.4,0,36154,,"Dilli, an ex-convict, endeavours to meet his daughter for the first time after leaving prison. However, his attempts are interrupted due to a drug raid planned by Inspector Bejoy."
692,Mirror,1975,107 ,"Biography, Drama",8.0,82,49226,$0.18M,"A dying man in his forties remembers his past. His childhood, his mother, the war, personal moments and things that tell of the recent history of all the Russian nation."
693,Hamlet,1996,242 ,Drama,7.7,0,39000,$4.41M,"Hamlet, Prince of Denmark, returns home to find his father murdered and his mother remarrying the murderer, his uncle. Meanwhile, war is brewing."
694,The Killing Fields,1984,141 ,"Biography, Drama, History",7.8,76,57258,$34.70M,"A journalist is trapped in Cambodia during tyrant Pol Pot's bloody 'Year Zero' cleansing campaign, which claimed the lives of two million 'undesirable' civilians."
695,All About My Mother,1999,101 ,Drama,7.8,87,99679,$8.26M,"Pedro Almodovar's Oscar-winning comedy (Best Foreign Film, 1999) about a bereaved mother, and overwrought actress, her jealous lover and a pregnant nun."
696,Touch of Evil,1958,95 ,"Crime, Drama, Film-Noir",8.0,99,106972,$2.24M,"A stark, perverse story of murder, kidnapping and police corruption in a Mexican border town."
697,From Here to Eternity,1953,118 ,"Drama, Romance, War",7.6,85,48882,$30.50M,"At a U.S. Army base in 1941 Hawaii, a private is cruelly punished for not boxing on his unit's team, while his commanding officer's wife and top aide begin a tentative affair."
698,Modern Times,1936,87 ,"Comedy, Drama, Romance",8.5,96,248453,$0.16M,The Tramp struggles to live in modern industrial society with the help of a young homeless woman.
699,Breaking the Waves,1996,159 ,Drama,7.8,81,69232,$4.04M,"Oilman Jan is paralyzed in an accident. His wife, who prayed for his return, feels guilty; even more, when Jan urges her to have sex with another."
700,Rashomon,1950,88 ,"Crime, Drama, Mystery",8.2,98,172808,$0.10M,"The rape of a bride and the murder of her samurai husband are recalled from the perspectives of a bandit, the bride, the samurai's ghost and a woodcutter."
701,Out of the Past,1947,97 ,"Crime, Drama, Film-Noir",8.0,85,38967,,"A private eye escapes his past to run a gas station in a small town, but his past catches up with him. Now he must return to the big city world of danger, corruption, double crosses, and duplicitous dames."
702,Anatomy of a Murder,1959,161 ,"Drama, Mystery",8.0,95,68433,$11.90M,"An upstate Michigan lawyer defends a soldier who claims he killed an innkeeper due to temporary insanity after the victim raped his wife. What is the truth, and will he win his case?"
703,Three Colors: Blue,1993,94 ,"Drama, Music, Mystery",7.9,87,106107,$1.32M,A woman struggles to find a way to live her life after the death of her husband and child.
704,The Manchurian Candidate,1962,126 ,"Drama, Thriller",7.9,94,77269,,An American POW in the Korean War is brainwashed as an unwitting assassin for an international Communist conspiracy.
705,Arsenic and Old Lace,1944,118 ,"Comedy, Crime, Thriller",7.9,0,72754,,A Brooklyn writer of books on the futility of marriage risks his reputation when he decides to tie the knot. Things get even more complicated when he learns on his wedding day that his beloved maiden aunts are habitual murderers.
706,Harold and Maude,1971,91 ,"Comedy, Drama, Romance",7.9,62,79558,,"Young, rich, and obsessed with death, Harold finds himself changed forever when he meets lively septuagenarian Maude at a funeral."
707,Short Term 12,2013,96 ,Drama,7.9,82,89602,$1.01M,A 20-something supervising staff member of a residential treatment facility navigates the troubled waters of that world alongside her co-worker and longtime boyfriend.
708,Open Your Eyes,1997,119 ,"Drama, Mystery, Sci-Fi",7.7,0,71162,$0.37M,"A very handsome man finds the love of his life, but he suffers an accident and needs to have his face rebuilt by surgery after it is severely disfigured."
709,Yojimbo,1961,110 ,"Action, Drama, Thriller",8.2,93,125919,#146,A crafty ronin comes to a town divided by two criminal gangs and decides to play them against each other to free the town.
710,Short Cuts,1993,188 ,"Comedy, Drama",7.7,81,46151,$6.11M,The day-to-day lives of several suburban Los Angeles residents.
711,Zulu,1964,138 ,"Drama, History, War",7.7,77,40920,,Outnumbered British soldiers do battle with Zulu warriors at Rorke's Drift.
712,A Christmas Story,1983,93 ,"Comedy, Family",7.9,77,160867,$20.61M,"In the 1940s, a young boy named Ralphie Parker attempts to convince his parents, teacher, and Santa Claus that a Red Ryder Range 200 Shot BB gun really is the perfect Christmas gift."
713,PK,2014,153 ,"Comedy, Drama, Sci-Fi",8.1,0,193190,$10.62M,An alien on Earth loses the only device he can use to communicate with his spaceship. His innocent nature and child-like questions force the country to evaluate the impact of there religious views on there people.
714,The Chaser,2008,125 ,"Action, Crime, Drama",7.8,64,69226,,A disgraced ex-policeman who runs a small ring of prostitutes finds himself in a race against time when one of his women goes missing.
715,25th Hour,2002,135 ,Drama,7.6,69,181679,$13.06M,"Cornered by the DEA, convicted New York drug dealer Montgomery Brogan reevaluates his life in the 24 remaining hours before facing a seven-year jail term."
716,Amour,2012,127 ,Drama,7.9,95,102957,$6.74M,"Georges and Anne are an octogenarian couple. They are cultivated, retired music teachers. Their daughter, also a musician, lives in Britain with her family. One day, Anne has a stroke, and the couple's bond of love is severely tested."
717,His Girl Friday,1940,92 ,"Comedy, Drama, Romance",7.8,0,60864,$0.30M,A newspaper editor uses every trick in the book to keep his ace reporter ex-wife from remarrying.
718,Jai Bhim,2021,164 ,"Crime, Drama, Mystery",8.8,0,206917,#235,"When a tribal man is arrested for a case of alleged theft, his wife turns to a human-rights lawyer to help bring justice."
719,Beasts of No Nation,2015,137 ,"Drama, War",7.7,79,84030,$0.08M,"A drama based on the experiences of Agu, a child soldier fighting in the civil war of an unnamed African country."
720,Who's Afraid of Virginia Woolf?,1966,131 ,Drama,8.0,75,77527,,"A bitter, aging couple, with the help of alcohol, use their young houseguests to fuel anguish and emotional pain towards each other over the course of a distressing night."
721,Manhattan,1979,96 ,"Comedy, Drama, Romance",7.8,83,143081,$45.70M,The life of a divorced television writer dating a teenage girl is further complicated when he falls in love with his best friend's mistress.
722,Invasion of the Body Snatchers,1956,80 ,"Drama, Horror, Sci-Fi",7.7,92,52207,,A small-town doctor learns that the population of his community is being replaced by emotionless alien duplicates.
723,Frankenstein,1931,70 ,"Drama, Horror, Sci-Fi",7.8,91,75683,,Dr. Frankenstein dares to tamper with life and death by creating a human monster out of lifeless body parts.
724,Night on Earth,1991,129 ,"Comedy, Drama",7.7,68,62926,$2.02M,An anthology of 5 different cab drivers in 5 American and European cities and their remarkable fares on the same eventful night.
725,Miracle in Cell No. 7,2019,132 ,Drama,8.2,0,51695,,A story of love between a mentally-ill father who was wrongly accused of murder and his lovely six year old daughter. Prison will be their home. Based on the 2013 Korean movie Miracle in Cell No. 7 (2013).
726,Sweet Smell of Success,1957,96 ,"Drama, Film-Noir",8.0,100,33830,,Powerful but unethical Broadway columnist J.J. Hunsecker coerces unscrupulous press agent Sidney Falco into breaking up his sister's romance with a jazz musician.
727,Whisper of the Heart,1995,111 ,"Animation, Drama, Family",7.8,75,66667,,"A love story between a girl who loves reading books, and a boy who has previously checked out all of the library books she chooses."
728,Three Colors: Red,1994,99 ,"Drama, Mystery, Romance",8.1,100,106364,$4.04M,A model discovers a retired judge is keen on invading people's privacy.
729,United 93,2006,111 ,"Action, Drama, History",7.6,90,108427,$31.57M,"A real-time account of the events on United Flight 93, one of the planes hijacked on September 11th, 2001 that crashed near Shanksville, Pennsylvania when passengers foiled the terrorist plot."
730,Key Largo,1948,100 ,"Action, Crime, Drama",7.7,0,42571,,"A man visits his war buddy's family hotel and finds a gangster running things. As a hurricane approaches, the two end up confronting each other."
731,Breathless,1960,90 ,"Crime, Drama",7.7,0,84711,$0.34M,"A small-time thief steals a car and impulsively murders a motorcycle policeman. Wanted by the authorities, he reunites with a hip American journalism student and attempts to persuade her to run away with him to Italy."
732,Strangers on a Train,1951,101 ,"Crime, Drama, Film-Noir",7.9,88,136935,$7.63M,A psychopath forces a tennis star to comply with his theory that two strangers can get away with murder.
733,The Man from Nowhere,2010,119 ,"Action, Crime, Drama",7.7,0,71998,$0.01M,A quiet pawnshop keeper with a violent past takes on a drug-and-organ trafficking ring in hope of saving the child who is his only friend.
734,The Big Sleep,1946,114 ,"Crime, Film-Noir, Mystery",7.9,86,88015,$6.54M,"Private detective Philip Marlowe is hired by a wealthy family. Before the complex case is over, he's seen murder, blackmail and what might be love."
735,Fitzcarraldo,1982,158 ,"Adventure, Drama",8.0,0,36476,,"The story of Brian Sweeney Fitzgerald, an extremely determined man who intends to build an opera house in the middle of a jungle."
736,Sita Ramam,2022,163 ,"Action, Drama, Mystery",8.6,0,60011,,"An orphan soldier, Lieutenant Ram's life changes, after he gets a letter from a girl named Sita. He meets her and love blossoms between them. When he comes back to his camp in Kashmir,After he gets caught in jail, he sends a letter to Sita which won't reach her."
737,A Taxi Driver,2017,137 ,"Action, Drama, History",7.9,69,27451,$1.53M,"A widowed father and taxi driver who drives a German reporter from Seoul to Gwangju to cover the 1980 uprising, soon finds himself regretting his decision after being caught in the violence around him."
738,Porco Rosso,1992,94 ,"Animation, Adventure, Comedy",7.7,83,94296,,"In 1930s Italy, a veteran World War I pilot is cursed to look like an anthropomorphic pig."
739,Drishyam,2015,163 ,"Crime, Drama, Mystery",8.2,0,88585,$0.74M,"Desperate measures are taken by a man who tries to save his family from the dark side of the law, after they commit an unexpected crime."
740,The Leopard,1963,186 ,"Drama, History",8.0,100,27343,,"The Prince of Salina, a noble aristocrat of impeccable integrity, tries to preserve his family and class amid the tumultuous social upheavals of 1860s Sicily."
741,The Hustler,1961,134 ,"Drama, Sport",8.0,90,84212,$8.28M,An up-and-coming pool player plays a long-time champion in a single high-stakes match.
742,Hard Boiled,1992,128 ,"Action, Crime, Thriller",7.7,0,52150,,A tough-as-nails cop teams up with an undercover agent to shut down a sinister mobster and his crew.
743,Waking Life,2001,99 ,"Animation, Drama, Fantasy",7.7,83,65594,$2.89M,A man shuffles through a dream meeting various people and discussing the meanings and purposes of the universe.
744,Bicycle Thieves,1948,89 ,Drama,8.3,0,167645,$0.33M,"In post-war Italy, a working-class man's bicycle is stolen, endangering his efforts to find work. He and his son set out to find it."
745,The 400 Blows,1959,99 ,"Crime, Drama",8.1,0,122208,#243,"A young boy, left without attention, delves into a life of petty crime."
746,Loving Vincent,2017,94 ,"Animation, Drama, Mystery",7.8,62,60431,$6.74M,"In a story depicted in oil painted animation, a young man comes to the last hometown of painter Vincent van Gogh to deliver the troubled artist's final letter and ends up investigating his final days there."
747,Control,2007,122 ,"Biography, Drama, Music",7.6,78,66979,$0.87M,"A profile of Ian Curtis, the enigmatic singer of Joy Division whose personal, professional, and romantic troubles led him to commit suicide at the age of 23."
748,The White Ribbon,2009,144 ,"Drama, Mystery, Thriller",7.8,84,75473,$2.22M,"Strange events happen in a small village in the north of Germany during the years before World War I, which seem to be ritual punishment. Who is responsible?"
749,A Woman Under the Influence,1974,155 ,"Drama, Romance",8.1,88,26786,$13.34M,"Although wife and mother Mabel is loved by her husband Nick, her mental illness places a strain on the marriage."
750,Z,1969,127 ,"Crime, Drama, Thriller",8.2,86,29995,$0.08M,The public murder of a prominent politician and doctor amid a violent demonstration is covered up by military and government officials. A tenacious magistrate is determined not to let them get away with it.
751,City Lights,1931,87 ,"Comedy, Drama, Romance",8.5,99,188634,$0.02M,"With the aid of a wealthy erratic tippler, a dewy-eyed tramp who has fallen in love with a sightless flower girl accumulates money to be able to help her medically."
752,Once Upon a Time in Anatolia,2011,157 ,"Crime, Drama, Thriller",7.8,82,47927,$0.14M,A group of men set out in search of a dead body in the Anatolian steppes.
753,The Adventures of Robin Hood,1938,102 ,"Action, Adventure, Romance",7.9,97,52843,$3.98M,"When Prince John and the Norman Lords begin oppressing the Saxon masses in King Richard's absence in 1190s England, a Saxon lord fights back as the outlaw leader of a resistance movement."
754,Talk to Her,2002,112 ,"Drama, Mystery, Romance",7.9,86,114968,$9.36M,Two men share an odd friendship while they care for two women who are both in deep comas.
755,Good Bye Lenin!,2003,121 ,"Comedy, Drama, Romance",7.7,68,149281,$4.06M,"In 1990, to protect his fragile mother from a fatal shock after a long coma, a young man must keep her from learning that her beloved nation of East Germany as she knew it has disappeared."
756,Hedwig and the Angry Inch,2001,95 ,"Comedy, Drama, Music",7.7,85,36508,$3.03M,A gender-queer punk-rock singer from East Berlin tours the U.S. with her band as she tells her life story and follows the former lover/band-mate who stole her songs.
757,Lilya 4-Ever,2002,109 ,"Crime, Drama",7.8,83,47188,$0.18M,"Sixteen-year-old Lilja and her only friend, the young boy Volodja, live in Russia, fantasizing about a better life. One day, Lilja falls in love with Andrej, who is going to Sweden, and invites Lilja to come along and start a new life."
758,The Taking of Pelham One Two Three,1974,104 ,"Action, Crime, Thriller",7.6,68,32962,$2.49M,"Four armed men hijack a New York City subway car and demand a ransom for the passengers. The city's police are faced with a conundrum: Even if it's paid, how could they get away?"
759,Happy Together,1997,96 ,"Drama, Romance",7.7,70,31665,$0.19M,A couple take a trip to Argentina but both men find their lives drifting apart in opposite directions.
760,The World's Fastest Indian,2005,127 ,"Biography, Drama, Sport",7.8,68,56515,$5.13M,"The story of New Zealander Burt Munro, who spent years rebuilding a 1920 Indian motorcycle, which helped him set the land speed world record at Utah's Bonneville Salt Flats in 1967."
761,Zindagi Na Milegi Dobara,2011,155 ,"Comedy, Drama, Musical",8.2,0,81459,$3.11M,Three friends decide to turn their fantasy vacation into reality after one of their friends gets engaged.
762,Sholay,1975,162 ,"Action, Adventure, Comedy",8.1,0,57090,,"After his family is murdered by a notorious and ruthless bandit, a former police officer enlists the services of two outlaws to capture the bandit."
763,The Diving Bell and the Butterfly,2007,112 ,"Biography, Drama",8.0,92,108919,$5.99M,The true story of Elle editor Jean-Dominique Bauby who suffers a stroke and has to live with an almost totally paralyzed body; only his left eye isn't paralyzed.
764,"Aguirre, the Wrath of God",1972,95 ,"Action, Adventure, Biography",7.8,0,59148,,"In the 16th century, the ruthless and insane Don Lope de Aguirre leads a Spanish expedition in search of El Dorado."
765,The Motorcycle Diaries,2004,126 ,"Adventure, Biography, Drama",7.7,75,102992,$16.78M,The dramatization of a motorcycle road trip Che Guevara went on in his youth that showed him his life's calling.
766,Harvey,1950,104 ,"Comedy, Drama, Fantasy",7.9,0,56828,,"Due to his insistence that he has an invisible six foot-tall rabbit for a best friend, a whimsical middle-aged man is thought by his family to be insane - but he may be wiser than anyone knows."
767,The Little Prince,2015,108 ,"Animation, Adventure, Drama",7.7,70,64235,$1.34M,"A little girl lives in a very grown-up world with her mother, who tries to prepare her for it. Her neighbor, the Aviator, introduces the girl to an extraordinary world where anything is possible, the world of the Little Prince."
768,Scarface,1932,93 ,"Action, Crime, Drama",7.7,90,29110,,"An ambitious and nearly insane violent gangster climbs the ladder of success in the mob, but his weaknesses prove to be his downfall."
769,Nebraska,2013,115 ,Drama,7.7,86,120328,$17.65M,"An aging, booze-addled father makes the trip from Montana to Nebraska with his estranged son in order to claim a million-dollar Mega Sweepstakes Marketing prize."
770,The Cabinet of Dr. Caligari,1920,67 ,"Horror, Mystery, Thriller",8.0,0,66653,,"Hypnotist Dr. Caligari uses a somnambulist, Cesare, to commit murders."
771,Tokyo Story,1953,136 ,Drama,8.2,100,64133,#209,"An old couple visit their children and grandchildren in the city, but receive little attention."
772,Andrei Rublev,1966,205 ,"Biography, Drama, History",8.1,0,55212,$0.10M,"The life, times and afflictions of the fifteenth-century Russian iconographer St. Andrei Rublev."
773,Uri: The Surgical Strike,2019,138 ,"Action, Drama, History",8.2,0,67411,$4.19M,"Indian army special forces execute a covert operation, avenging the killing of fellow army men at their base by a terrorist group."
774,Head-On,2004,121 ,"Drama, Romance",7.9,78,55844,,"With the intention to break free from the strict familial restrictions, a suicidal young woman sets up a marriage of convenience with a forty-year-old addict, an act that will lead to an outburst of envious love."
775,Ninja Scroll,1993,94 ,"Animation, Action, Adventure",7.8,0,38899,,A vagabond swordsman is aided by a kunoichi and a spy in battling a demonic clan of killers - led by a ghost from his past - who are bent on overthrowing the Tokugawa Shogunate.
776,The Broken Circle Breakdown,2012,111 ,"Drama, Music, Romance",7.7,70,42038,$0.18M,"Elise and Didier fall in love at first sight, in spite of their differences. He talks, she listens. He's a romantic atheist, she's a religious realist. When their daughter becomes seriously ill, their love is put on trial."
777,Mr. Smith Goes to Washington,1939,129 ,"Comedy, Drama",8.1,73,117651,$9.60M,"A naive youth leader is appointed to fill a vacancy in the U.S. Senate. His idealistic plans promptly collide with corruption at home and subterfuge from his hero in Washington, but he tries to forge ahead despite attacks on his character."
